kalimat;tag
hampir 4bln ini saya punya masalah dan merasa tertekan krna lingkungan sekitarl. Yg mana setelah sy nangis, sy selalu skt kepala. Yg akhirnya jika berpikir keras jd skt kepala jg. Setiap Merasa takut dan cemas, perut bagian atas sy sakit, mules, pusing. Kt temen sy jadi kaya org bloon karna ga nangkep kalo org ngomong. sy jd ga fokus ketika interview. Sy sering ngelamun smbil scroll sosmed terus menerus. Saya jd mudah nangis hanya karna mslh kecil. Kdg jadi krg peduli sm org di sekitar sy. terkadang sy ga nafsu makan, terkadang jg sy makan sangat banyak meski sdh kenyang. Sudh seminggu ini tidur di atas jam 1 mlm, dan bangun jam 6 dengan perasaan gelisah.Apakah sy depresi dgn diatas? Dan jika iya apa sy harus pergi ke ;depresi
adik saya pasca kecelakaan motor ada perubahan prilaku jadi agresif, pemarah dan bicara tidak terkontrol, kalo mau pemeriksaan ke rumah sakit ke poli apa ya dok ;depresi
tanya dok, saya bekerja sudah bekeluarga dan memiliki ini saya itu selalu teringat masa lalu ketika saya kuliah/sebelum berkeluarga, mengingatnya kebanyakan kenangan positif dan bahagia, dan rasanya itu ingin kembali ke masa itu. Saya juga kadang suka tiba2 sedih, apalagi kalo tiba2 nyess keingat masa lalu. Kira2 saya kenapa ya karna saya merasa kurang bahagia dengan keadaan skarang ? saya juga hampir setiap hari tidur diatas jam 12 karna memang aktivitas rumah tangga selesai di jam 12 malam. Di tempat kerja juga saya jarang mengobrol karna lingkungan nya bekerja sendiri2. Kalau setiba dirumah main sama anak saja dan jarang mengobrol dengan suami terkait aktivitas saya, karna ya kalo saya ngobrol dengan suami kadang ga ada pembicaraan dua arah. Saya juga suka teringat dan jadi sedih ketika setelah melahirkan saya ga bisa menyusui ASI apa karna itu juga ya ;depresi
dok mau ya saya suka merasa cemas ,keringat dingin ,badan gemetar ,jantung berdebar, merasa gugup jika berbicara pada saat saya berbicara dan dilihat banyak orang saya selalu berpikir kalau mereka risih terhadap saya lalusaya juga merasa seperti tidak dipedulikan dan pasti mereka akan membicarakan saya dibelakang, setiap saya merasa orang orang risih terhadap saya saya selalu mencari perhatian bahkan sampai dengan menggores tangan saya supaya diperhatikan. saya juga selalu memperhatikan penampilan saya seperti jika saya memakai baju itu saya akan dijauhi , jika saya membiarkan rambut saya panjang saya akan dikucilkan dan saya juga merasa sedang di awasi seseorang. saya juga sulit mengendalikan emosi bahkan setiap saya di kritik orang saya selalu merasa kesal dan marah besar lalu berfikir bahwa semua orang akan tidak suka dengan saya atas kritik itu , jika saya marah dengan ibu saya saya berusaha menahan itu dengan mengunci diri di kamar dan merasa cemas hingga menggigit kuku saya , mencabut bibir kulit dan menangis karna saya selalu merasa seolah ibu saya tidak menyayangi bagaimana ya ;depresi
ayah saya berumur kurang lebih 65tahun, sedang menunjukan depresi seperti halusinasi, gangguan kecemasan, takut dan lain lain. sikap atau tindakan seperti apa yang harus kami lakukan? bagaimana cara kami menyampaikan mengenai kondisi ayah saya tersebut dan ingin diajak untuk berobat ke ;depresi
Sebelumnya saya cerita kan terlebih dahulu kondisinya, jadi pacar saya itu menderita sindrom mielodisplasia terakhir cek sepertiya udah stage 4 walaupun dia gakmau kasitau detailnya, keadaan dia dari awal juli kemaren semakin memburuk saya mencoba berpikir positif pasti dia bakalan survive saya selalu berpikiran seperti ituu, puncaknya adalah tanggal 30 Agustus 2021 kemaren adalah momen terakhir dia chat saya dan besoknya dia senseless atau gak sadarkan diri sampe tanggal 03 September 2021 kemarin dia passed away... Awalnya saya shock tapi hari-hari berikutnya saya sedih banget sampe dada saya kerasa sakit banget air mata pun udah gak keluar lagi gara-gara saya nangis seharian siang malem, saya udah ga bisa berpikir jernih lagi, saya kayak orang gila foto-foto dia saya ajak bicara seolah dia itu masih ada di dunia ini, saya ga terima faktanya dia udah meninggal... Dan dari kemarin saya udah ada niat bunuh diri buat nyusul dia saya tau itu salah tapi saya gak bisa nahan kesedihan ini, dan saya gak bisa nahan diri saya. Saya udah coba cerita ke teman2 terdekat saya yang ada saya malah pengen cepet2 nyusul pacar saya, saya juga mencoba untuk tidak berada di posisi yg sendirian tapi tetap saja keinginan menyakiti diri sendiri dan niat bunuh diri selalu tinggi, saya pun mencoba untuk mencari alasan untuk tetap hidup tapi kalo inget pacar saya yang udah gada saya sedih lagi dan ingin menyakiti diri saya sendiri.. Saya lama-lama gila beneran hahaha... Saya kacau bangettt... Saya ga terima dia udah gada di dunia ini.. Kenapa gak saya juga yg diambil? Saya tau kalo dokter baca curhatan saya ini bakalan ngatain saya gila, bucin atau apapun itu tapi saya gapeduli.. Saya sedih bangetttt ;depresi
dok. Dok saya sering sekali tiba-tiba pikirannya saya melancong kemana-mana (tidak segera lulus kuliah, takut orang tua terbebani, dll) ketika dalam keadaan sendiri dan secara langsung pasti saya langsung mengeluarkan air mata dok dan sempat berpikiran untuk bunuh diri. Apakah hal tersebut termasuk gejala depresi dok? dan mohon solusinya dok, karena selama ini saya pendam sendiri. Terima ;depresi
cukup lama saya kehilangan semangat untuk bersosialisasi, saya juga kehilangan semangat untuk melakukan pembelajaran, bahkan menekuni hobi saya sendiri. Orang disekeliling saya sepertinya tak mau menerima saya yang seperti ini, tekanan terus datang, saya cuma lelah. Apa saya boleh lelah seperti ;depresi
saya ingin bertanya.Akhir akhir ini saya sangat pelupa atau mudah lupa, saya juga sering mengalami sakit kepala sebelah disertai mual. Selain itu saya juga mengalami cemas tanpa sebab, jantung saya berdetak kencang dan badan saya bergetar. Dan juga ketika saya sedang tertekan, saya selalu mengurung diri, mudah marah, menangis, bahkan melukai diri saya sendiri dengan menyayat pergelangan tangan saya dengan ;depresi
malam dok, saya seorang remaja berusia 18 tahun, dari semenjak lulus SD dan awal awal masuk SMP itu fikiran saya sering pengen nangis, ketika perpindahan dari SMP ke SMK pun sama, setiap akan berangkat sekolah saya pasti nangis, sama seperti sekarang dok, sekarang saya sudah lulus smk dan akan melanjutkan dengan bekerja, hal itu terjadi lagi saya seperti tertekan dengan pekerjaan yang saya lakukan, padahal sebelum melamar pekerjaan itu semangat saya sangat besar untuk bekerja tapi ketika saya sudah bekerja saya merasa sangat tertekan,d an saya berfikir apakah karena saya tidak memiliki minat lebih di bidang itu, dan saya berencana resign dari tempat saya bekerja, dan mencari pekerjaan yang lainnya, itu biasanya kenapa dok? Mohon ;depresi
dok, saya sering merasa sedih terkadang saya selalu rewel untuk hal makanan atau apapun. Berat badan pun tidak pernah naik dari hingga sekarang masih sama . Dok, saya sering merasa sedih, nangis, merasa kesepian tapi saya tidak tau penyebab nya apa, bahkan saya merasa tidak berguna hidup dan saya tidak pernah ingin di lahirkan . Saya selalu merasa seperti ini . Lalu saya cari tau di google tentang depresi, saya melihat bahwa Ciri ciri gangguan depresi mayor ada pada saya, dan saya melihat obat yang di anjurkan untuk depresi seperti nassa, apa itu terjual bebas di apotik apa harus dengan resep dokter ;depresi
dok mau tanya cara berhenti in teman sy agar ga self harm lgi gmna dok,tmen sy sring depresi masalah keluarga di rumah teman sy ini sayat tangannya,minum gajelas,minum obat nyamuk di blender,minum pembersih kaca tolong dok sy mau bantu tpi takut di marahin keluarga ;depresi
pagi, saya ingin bertanya. Apa yang sebaiknya saya lakukan? Saya kadang tidak mengerti apa yang harus saya lalukan, saat ada masalah, saya selalu menyalahkan diri saya atas apa yang terjadi, padahal kadang itu bukan salah saya sepenuhnya, tetapi entah karna perasaan saya yang berlebihan/terlalu sensitive, saya selalu merasa orang lain juga menyalahkan saya. Keadaan juga seakan ikut menyalahkan saya. Kadang saya juga berpikir itu bukan salah saya juga, tapi semakin saya berpikir seperti itu, saya jadi merasa jahat, seakan saya mengikari kejadian. Tapi saat saya merenungi kesalahan tersebut, dan berdiam diri, akan tetapi orang lain jadi menganggap saya tidak bertanggung jawab dan mengacuhkan saya, merasa saya sedang ngambek pada mereka. Padahal saya sedang intropeksi diri sendiri. Lalu saat saya jadi pendiam, lingkungan saya seakan tidak peduli, dan menggangap saya tidak ada, mereka akan bicara dan bergurau bersama tanpa merasa ada yang salah pada jadi berpikir apa hidup dilingkungan yang cuek dan orang2 yg tidak pekah seperti ini adalah baik / pertanyaan yang timbul dlm pikiran saya, tapi saya pun tak bisa menjawabnya. Harus bagaimana sebaiknya saya? Saya sangat ingin keluar dari keadaan seperti ini, tapi untuk melangkah ke jalan yang lainpun saya juga takut. Saya merasa kecil dan tidak pantas untuk mengeluh. Tapi mendengar mereka mengeluh, terasa sangat memuakkan, mengapa mereka bisa dengan mudahnya mengeluh tanpa tau persaan orang lain. Mengapa saya tidak ;depresi
dok, kenapa setiap saya keinget hal tentang masa lalu badan saya langsung dingin, dada deg degan, nafas pun kadang sulit dok, dimana pun saya keinget masa lalu gejala seperti ini terjadi tiba tiba, terima kasih ;depresi
teman saya ada yang cerita ke saya bahwa belakangan ini sudah beberapa kali dia melakukan percobaan bunuh diri mulai dari OD, mencampur insto dengan air minumnya setiap kali dia ingin minum, sengaja menghirup rodentisida dan bahkan pernah memakannya dicampur dengan pisang dan bolu. Tapi setelah dia melakukan percobaan bunuh diri itu tubuhnya tidak merasakan apa-apa. Hanya saja fesesnya beberapa kali berdarah. Namun sekarang dia sudah diajak bicara, susah berkonsentrasi, susah berpikir, bingung, susah belajar, dan susah menangkap. Apakah mungkin itu karena efek/pengaruh dari percobaan bunuh diri yang pernah dia lakukan. Dia memang pernah di diagnosis depresi sebelumnya oleh dokter kejiwaan dan diberi anti depresan namun obat yang diberikan hanya satu papan dan dan setelah obatnya itu habis dia tidak pernah lagi ke psikiater karena masalah ;depresi
saya ingin bertanya, knp setiap saya terkena Maslah sedikit pun, saya akan mengalami kecemasan yg berkepanjangan, dan ketika saya mengalami nya,saya akan merasa takut jika sendiri,dan ketika saya keluar bersama saya akan merasa tenang untuk sebentar, dan pernah jg saya mengalami ketika mendengar suara yang keras saya akan takut/menggigil, tpi ketika saya merasa sehat,saya lebih suka ;depresi
sore dok, saya adalah mahasiswa aktif di salah satu universitas di Surabaya. Belakangan ini sekitar mulai bulan januari saya sering merasakan pertanyaan negatif selalu muncul dalam pikiran saya. Awalnya hanya ketika menjelang tidur malam hari, namun semakin lama semakin sering. Dan saya merasa sulit untuk berkonsemtrasi dan selalu malas melakukan sesuatu. Bahkan sering dimana saya satu hari hanya tidur dan tidur. Saya selalu memcemaskan bagaimana kehidupan saya kedepan, bagaimana saya bisa mendapatkan uang, mengapa saya yang awalnya produktif sekarang menjadi sangat malas, mengapa saya selalu merasa lelah. Kehidupan sosial saya tidak memiliki banyak teman, dan saya tinggal di kos dimana hampir setiap hari saya sendirian dan jarang berinteraksi dengan orang lain. Saya bingung apa yang harus saya lakukan agar saya bisa kembali menjadi produktif lagi dan bagaimana cara saya bisa mengatasi hal ini? ;depresi
Laki-laki berusia 18 tahun beriwayat tekanan darah rendah. Saya juga sering Stress dan depresi akan kehidupan sosial saya hingga saya merasa hampa. saya ekstrovert tapi di kehampaan karena minder. ditambah lagi karena pandemi Covid-19 ini jadi lebih sering 2 minggu yang lalu saya merasakan sakit kepala di kiri, kanan, dan belakang secara terus menerus disertai denyutan dan jantung berdebar-debar. Tidak ada gejala lain seperti demam, mual, ataupun muntah. saya juga sudah memakan obat paracetamol, tetapi tidak manjur. Akhirnya saya berusaha sering mengistirahatkan tubuh, tetapi tidak manjur dokter saya menderita penyakit apa? karena saya sudah mencoba segala cara yang dilakukan di rumah untuk supaya dapat meredakan sakit kepala berdenyut ini. ;depresi
dok, Saya single mom berusia 36 tahun. 2 tahun lalu suami saya meninggalkan saya karena penyakit gagal ginjal yang di deritanya. Saat ini saya tinggal bersama ibu saya (62tahun) dan anak saya (9thn).Ibu saya seorang yang perfectionist. Rumah harus selalu dalam keadaan rapi, dan sangat addicted dengan kebersihan. Karena itu setiap saya WFH, dan sebelum ibu saya pulang dari kantor, saya sudah melakukan semua pekerjaan rumah (membersihkan toilet, memanaskan makanan, menyiram tanaman, mengepel lantai, mencuci baju dan mandi) hanya supaya ibu saya tidak marah sama saya dan anak saya. Saya juga harus berpura² bahagia dan tetap tersenyum, menjawab pertanyaan dia dengan baik ketika hati saya sedang tidak mood. Dan jujur saya merasa sangat tertekan, anak saya pun begitu. Kami menjalani rutinitas dan kehidupan yang ibu saya inginkan di rumah itu. Dan satu-satunya tempat tenang saya adalah kamar.Belakangan ini saya sering menangis tengah malam, overthinking dan menangis lagi, bahkan menonton film aja saya tiba² menangis sendiri, seperti saya memang harus menangis di hari² itu. Saya sering merasa cemas bagaimana saya akan menjalani hari² saya ke depannya, bagaimana saya akan menghidupi anak saya dengan kehidupan yang lebih baik, bagaimana saya bisa membuat ibu saya senang dengan hati yang saya sendiri ga tau gimana perasaan saya sebenarnya. Beberapa kali saya berpikir untuk bunuh diri karena saya merasa sangat tidak bahagia dengan hidup saya. Bukan ini kehidupan yang saya ingin jalankan, tapi saya punya anak..Saya ingin keluar dari rumah ini sama anak saya tapi takut ibu saya mencaci maki saya dan menyerang saya secara verbal terus²an tapi saya juga tidak mungkin bertahan dengan kondisi seperti ini..Apa saya baik² saja, Dok..? Apa yang harus saya lakukan..? Terima kasih sebelumnya yaa ;depresi
dok , nama saya dana , saya sering sekali ingin mengakhiri hidup saya , saya merasa putus asa setiap hari , saya merasa hidup saya tidak berguna , saya terus menerus memikirkan hidup saya karen tidak mendapat perhatian dari orang tua saya , suatu malam saya panik attack , saya memukul kepala saya terus menerus , dan saya melakukan barcode , saya menangis sepanjang malam, saya ketahuan oleh adek saya ingin bundir 3 kali , bagaimana solusi dokter agar saya tidak melakukan hal semacam itu lagi. ;depresi
dok saya masih berusia 19 tahunSaya sudah 3 kali berobat ke dokter psiaktrisDan saya di nyatakan sakit depresi dan gangguan kecemasan Rencana nya saya akan kuliah tahun ini apakah orang yg punya gangguan kejiwaan seperti saya bisa kuliah? Jujur saya khawatir akan menyakiti diri ;depresi
dok, saya sering ngerasa tidak bisa mengontrol emosional saya sendiri. bisa tiba tiba nangis karena rasa khawatir, sesak nafas dan jantung berdetak cepat saat merasa ada suara keras. tekadang jika sudah meledak rasa yg gak bisa ditahan bisa samapai nangis dan terus menyalahkan diri sendiri. sempat ingin mrlakukan renacana bunuh diri serring berfikiran karena ketika ekspetasi tk sesuai dan kecewa ttp ga jdi untuk bunuh diri tp sering berfikir untuk melakukan. ketika merasa kecewa sedih yg gk orang lain paham dan sakit itu ada di dlm diri aku lebih memilih untuk melukai diri sendiri agar sakitnya brrpindah. terimakasi dok jawab yaa karena aku bingung dgn diri aku ;depresi
dok, sudah mau jalan 2 minggu ini saya sering menangis tanpa alasan yang jelas, dan sering marah-marah tanpa alasan yang jelas, saya sempat selfharm juga dok,bagaimana menurut pendapat ;depresi
malam dok, saya ingin bertanya. Saya memiliki banyak tekanan yang membuat saya stress, seperti masalah keluarga, keuangan, bahkan pertemanan yang membuat saya sering menangis pada malam hari dan bahkan sering menyayat tangan saya dengan kaca ataupun silet. Setiap saya mengalami tekanan tersebut saya merasa dada saya sesak lalu menangis, saya juga selalu menyebut kata kata ingin bunuh diri dan tidak ingin hidup lagi, bahkan barusan saya kembali mengalami tekanan itu dan menangis, kembali ingin bunuh diri lalu berhenti dengan tertawa. Kira kira apakah kasus saya ini sudah termasuk depresi dok? Mohon bantuannya dan bagaimana cara saya mengatasinya dok ;depresi
saya mau nanya, umur saya 15 tahun. saya bingung sama diri saya. saya juga suka sedih dengan apa yang saya baca padahal tidak ada yg menyedihkan. saya dulu sering bergaul dan saya suka melakukan kesukaan saya, tapi sekarang tidak. orang yang menglihat saya selalu bilang saya berjalan sambil melamun. saya juga takut berbicara didepan orang-orang, dan hal hal sepele juga saya takut untuk melakukannya. napsu makan saya juga berkurang, ketika saya ditegur juga perasaan saya sedih dan saya suka menangis padahal teguran itu tidak ada nada membentak tapi bagi saya menyakitkan. saya juga tidak suka tertawa lagi, saya selalu menganggap semua serius. jika saya sendiri saya suka bengong padahal tidak ada yg saya pikirkan. terkadang saya juga suka setres karna hal sepele yang membuat saya susah ;depresi
saya azahra Saya ingin bertanya apakah situasi gejala2 depresi atau cuma saya yang overthinkingDari kecil sampai sekarang berumur 17 saya selalu dikekang,seolah tidak memiliki dunia sendiri,tidak bisa jadi diri sendiri,dan selalu dipaksa atas dasar apa yang tidak saya sukai bahkan saya benci.Seiring berjalannya waktu saya mulai kehilangan teman yang dulunya bisa saya percaya untuk mendengarkan cerita saya,tapi sekarang semua renggang karena saya hanya bisa membantunya secara virtual.Bahkan saya sering mengalami kekerasan oleh ayah saya,bukan cuma ayah saya tapi kakak saya juga bersikap kasar kepada saya,dan omongan ibu saya selalu membuat hati saya sakit dan ingin sekali mengakhiri hidup saya.Hati saya lama kelamaan akan mati rasa jika seperti ini trus terjadi.Dokter mohon jelaskan apa yang terjadi kepada saya.Terima ;depresi
dok,aku ila umurku 16 thn, jadi gini dok ini aku sering menyakiti diri sendiri,ntah itu menyakiti diri sendiri atau mencekik diri.semua itu terjadi mungkin karena aku sudah tidak kuat lagi menjalani ini semua,penyebabnya adalah orang tuaku sendiri.Semua ini bermula saat aku masih kelas 3 sd ibuku sempat berpacaran/selingkuh.saya tau hal ini karena ibu sempat bilang keadik saya saat umurnya 3thn punya 2 ayah, 1 ayah 1 bapak kalo mbak cuman punya setelah mendengar itu saat saya sendiri saya terus memahami apa maksud ibu berbicara seperti itu. Diumur yang menurutku sangat kecil saya harus harus memikirkan hal yang sangat berat dan mengganggu.seiring berjalannya waktu aku tumbuh dewasa dan aku mulai paham arti kata itu dan seiring berjalannya waktu pula muncul dalam ibu benar melakukan hal iya dengan mereka pernah hubungan itu sudah itu muncul disetiap aku sendirian,sampai aku menginjak bangku smp kelas 2 kedok ibu terbongkar mereka bertengkar bapk pergi dari rumah selama 7 hari saat siang aku selalu sendiri karena ibu bekerja dari pagi sampai sore.sepulang sekolah aku selalu curhat pada tuhanku dan memohon padanya untuk segera mengembalikan ini seperti semula. Lalu pada suatu hari ibu bertemu bpk mereka membicarakan ini semua,karna saat itu rasa ingin tauku tinggi akupun menguping mereka namun gagal karena adikku selalu mengajak aku bermain. Besok malamnya ibu pergi ke abah (teman kakek/saudara jauh) untuk meminta doa atau aku menyebutnya agar bapak kembali kerumah, itu berhasil selang satu hari ibu pergi kerumah aba bapk pulang,namun setelah itu juga banyak masalah yang datang,mereka bertengkar aku yang menonton dari kejauhan ini bukan keinginanku namun rumahku kecil jadi aku terpaksa melihat itu dan ingin pergi dari rumahpun tidak diizinkan. Dari hari itu saya sering menangis kadang teringat,kadang ada masalah baru,kadangpun menangis tanpa alasan yang tepat. Dan hal yang aku hadapi di sd dulu terulang lagi cuman sekarang yang melakukan bukan ibu melainkan bapk.tidak butuh waktu lama ibu tau itu semua karena gerak gerik bapak yang berbeda dari biasanya - bau bapak yang berbeda saat pulang kerja- Sikap yang manja- Menutupi sesuatu dari ibu- Saat ulang tahun adikku yang ke10,malangnya dia harus mendapat hadiah yang buruk. Iya orang tuaku bertengkar dari jam 12 malam sampai 3 dini hari. Aku yang takut mental adikku rusak aku menyuruhnya untuk diam dikamarku namun ditolak. Karna kesal aku manangis sejadi jadinya,melukai tanganku,menjambak jambak rambut,memukul kepala.Dan iya hubungan meraka tidak membaik sampai sekarang,begitupun diriku tidak membaik dan mungkin semakin buruk.dlam hal ini jangansalahkan aku salahkan mereka kenapa mereka bertengkar didepanku?ingin rasanya mengakhiri ini semua lelah rasanya.Menurut dokter - apakah aku saja? - Apa aku sedang depresi?- Apa mungkin aku sudah gila?Mohon jawabannya dok karena aku merasa aku berbeda dari aku yang dulu.- Dulu saat aku memegang benda tajam aku tidak merasaka sekarang sering muncul untuk menyakiti diri sendiri atau menyakiti orang lain.- Dulu aku yang tidak suka obat sekarang sering mengonsumsinya ntah itu obat tidur/lain sebagainya itupun sekali minum melebihi dosis- Sering menangis (pagi/siang/sore)- Menyendiri- Jarang tidur atau sebaliknya- Jarang makan atau sebaliknyaTolong penjelasanrnya dok...Maaf jika ila curhatTerimakasih ;depresi
dok, saya mau bertanya,Saya perempuan umur 14 tahun, saya menjadi lebih sensitif ketika memasuki umur 13 th. Lebih banyak menangis secara diam-diam dan suka mengurung diri di kamar dalam keadaan gelap. Saya menjadi sering merasa lelah walaupun tidak melakukan apa-apa. Saya merasa sangat kesepian walaupun saya punya banyak teman online. Menjadi takut untuk berinteraksi sosial, padahal hanya dengan keluarga. Sering sekali berbicara sendiri dan ketika dimarahi saya sering merasa bahwa saya tidak berharga dan ingin menangis. Ketika keluarga saya marah, mereka sering mengatakan hal-hal hina pada saya, bahkan pernah sampai ditampar di hadapan banyak orang hanya karena saya tidak izin keluar rumah padahal hanya ke rumah bude yang letaknya beberapa rumah dari rumah saya. Saya tidak berani mengungkapkan keluh kesah dan keinginan terbesar saya pada siapapun. Saya kehilangan motivasi belajar seluruhnya pada beberapa bulan setelah masuk SMP. Saya benar-benar tidak tahu saya ini ;depresi
dok, saya perempuan 23thn saat ini saya sdg merasa depresi yg saya anggap berat dan sudah berjalan kurleb 2 bulan. Saya kehilangan minat saya utk beraktifitas seperti biasa bahkan utk melakukan hobby/kesenangan saya, sempat berfikir utk melukai diri saya walopun tdk sampai bunuh diri, saya kehilangan nafsu makan, saya juga seperti menarik diri dari lingkungan saya, saya malas rasanya jika diajak bicara dan berkumpul dgn teman2 saya. Teman2 saya sepertinya sdh menyadari saya sdg merasa tertekan karena mereka bilang wajah saya berbeda. Saya sangat tersiksa dgn perasaan sedih, merasa bersalah, overthinking ini karna sudah 2 bulan lamanya. Awalnya saya kira mungkin hanya beberapa hari perasaan ini akan hilang. 2 tahun yang lalu saya juga pernah merasakan perasaan tertekan depresi seperti ini tapi tidak selama ini tdk lebih dari 1 bulan dan setelah itu saya memang sering berfikir dan takut bagaimana jika perasaan itu muncul lagi. Dok apakah saya memiliki gangguan kesehatan mental atau ini masih wajar? Apa yang harus saya lakukan sekarang ;depresi
dok. saya seorang mahasiswa dan sedang dlm masa menyusun tugas skripsi. saya merasa bahwa akhir2 ini saya tidak memiliki semangat hidup karena masa pandemi mulai 2020. saat ini saya sangat khawatir cemas merasa mual selama 2 bulan. saya jg terkadang merasa tak berguna selalu ngantuk dan mudah lelah walaupun sudah tidur cukup dan makan teratur. saat ini saya tinggal sendiri dan masih ditanggung orangtua. saya jg tidak bisa berbicara terbuka kepada keluarga dan teman karena saya pribadi yg introvet dan merasa bahwa saya hanya kurang minat diri. saya jg menjadi mudah bingung ketika mulai menyusun rencana sehari-hari. saat ini pun saya merasa pening setiap malam dan ngantuk di pagi hari serasa saya tidak punya apa2 padahal selalu dimotivasi orangtua. sebaiknya apa yg harus saya lakukan ;depresi
dok.. Sy alya, umur 14 tahun tp saya pinjam akun ortu saya. Jadi sejak tahun lalu saya merasa bahwa saya tidak bisa mengontrol diri saya. Saya merasa berubah dan merasa kalau diri saya yang sekarang itu bukan saya, saat saya mengalami sesuatu dan takut dimarahi terkadang saya berfikir saya bundir atau sakit aja ya? Biar gausah gini Saya juga merasa sedih karena ingin berubah jadi lebih baik tapi tidak bisa. Saya selalu marah kalau ada barang/hal kecil yang punya saya itu diambil/disembunyikan. Saya sering merasa takut bersosialisasi dan sering takut salah ngomong ketika bersama teman saya. Saya sering ingin marah, mengeluarkan semua perasaan saya tapi saya tidak bisa. Saat saya bicara pada orang tua bahwa saya menyukai perempuan dan juga laki laki mereka malah bilang bahwa saya sakit jiwa. Saya merasa kesepian tapi takut mencari teman juga. Kalo kayak gitu kira-kira kenapa ya, ;depresi
dok, saya mau bercerita tentang ade saya. dia mengalami beberapa kejadian di pondoknya yang mengakibatkan trauma dan sifat nya yang berubah. Mama ingin SMA ade saya kembali di pondok namun ade saya menolak dengan sangat keras dan mulai menangis. Dia pernah bercerita kepada saya apabila dia mulai mengingat trauma nya atau karena mama maksa ade saya dia akan mengalami rasa panik, cemas, rasa tidak suka, dada terasa sesak. Saya sudah bilang ke mama agar dia jangan di masukkan pondok dulu, lebih baik di ajak ke psikolog, namun kaka saya bilang agar ade saya harus mulai melawan rasa trauma nya. menurut dokter apa yang harus saya lakukan terhadap ade ;depresi
