kalimat;tag
saya berumur 20 tahun saya tidak punya semangat dan minat untuk beraktifitas dan juga saya mengalami ganguan tidur sudah 6 bulan Ini saya hanya dirunah saja tidak ada kegiatan yang mau saya kerjakan dok itu kenapa ;insomnia
siang dok,Saya ingin bertanya, cara mengatasi insomnia akut untuk usia 26 th, kalau malam tidak bisa tidur sudah dipaksakan tetap tidak bisa tidur, hanya air mata saja yg keluar karna perih padahal mata sudah sangat lelah tapi badan tidak bisa tidur, kalau siangpun jarang sekali tidur, tidur habis subuh, tetapi itupun kalau sudah terasa mengantuk tpi jika tidak bisa seharian tidak tidurMohon bantuanya ;insomnia
saya sering begadang karena kerjaannya dan tidak bisa tidur di siang hari karena sibuk juga. Sering kali saya mendapatinya tiba tiba tertidur di saat beraktivitas. Apakah itu gejala narkolepsi dok? Lalu makanan atau minuman apa yang bisa saya berikan untuknya agar ia bisa lebih ;insomnia
Saya mau nanya..Udh hampir beberapa bulan ini kepala saya seperti di cengkram dan berdenyut² sperti gempa.. Saat saya sedang memejamkan mata kepala saya berdenyut terasa mengganggu,ketika berdiri saya juga sering tidak seimbang sampai sempoyonganDan saya juga mengalami insomnia..Kira kira apa yg sedang saya alami dok?? ;insomnia
saya sudah hampir 6 bulan sering menangis terutama malam hari sebelum tidur, dan insomnia,saya jga sering orang yang dekat dengan saya memanh faktor utama saya seperti karna orang yang dekat dengan saya (cwo). Kami dekat sudah 3 tahun dan ada hal yang membuat saya kecewa sampai saya inget terus, dan 2 minggu terakhir ini saya semakin drop tidak nafsu makan, makin susah tidur, intensitas nangis juga tidak tau kondisi entah siang malam sore, tidur tidak tenang hati sama pikiran ga jelas, dan saya tidak bisa menghindari itu dok. Saya sadar tapi saya sudah berusaha berbagai cara malah semakin saya seperti trauma entah apa yang membuat saya ingat masa lalu itu tempat, atau orang yany nyebut namanya itu saya langsung berubah mood sampai kepala saya kadang sakit gak konsentrasi terutama. Apakah ada solusi dok? Biar saya bisa lepas dari rasa cemas, panik dan trauma ;insomnia
imsomnia bisa terjadi. Tertidur lebih dari jam 12 malam, kejadian yang biasa dialami adalah terjadi ereksi pada kelamin dan dilanjutkan Onani. karena masih juga tidak bisa tidur keingan itu datang sendiri dan hampir setiap ;insomnia
habis konsultasi dgn dokter spesialis spkj dan d berikan beberapa obat,karena sy ini penderita insomnia berat,ansietas berat bahkan rasanya smpai nyeri dan sngat2 mnghmbat aktivitas sy sbgai pekerja, sblumnya sy sdh konsul dgn dokter tsb sblumnya dan sy d brikan resep amitriptyline,riklona,dan alprazolam tpi hasilnya sy masih nihil tdk ada yg brubah ktika mata sy sngt lelah tpi tetap sprti biasa aplgi rasa nyeri di skitar wajah sy dan tulang blkg sy ,jdi sy kmbali ke dkter lgi konsultasikan hal yg trjadi akhirnya dokter mmberi resep bru yg hmpir sm tpi cuma riklona sj yg d ganti,tpi sy agak khawatir krna isu tntang obat dlm resep itu obat itu dumolid jdi sy tdk mngkonsumsi riklona lgi,d gantikan dgn amitriptyline,dumolid,alprazolam(camlet),dan sypun membelinya dgn sesuai resep tpi istri sy tdk sngaja mmbuang aturan minumnya dan sy tmbah cemas krn isu dumolid itu jd sy tdk sy ingin kmbli menanykn atran mnum tpi sang dokter telah wafat,yg ingin sy tanyakan saya ingin tahu aturan minum yg benar dgn resep yg d berikan almarhum dokter spesialis jiwa ;insomnia
akhir2 saya agak susah tidur Dan energy saya terasa tidak habis2 sampai pagi hari. Saya coba stop coffee 1 cup per day sepertinya tidak begitu ada beda Karena saya terbiasa coffee. Makanan yang saya makan sepertinya cukup hanya stop carbo dan jumlah protein dll cukup kebetulan saya vegetarian. Saya coba malam yoga 1,5 jam supaya capek tapi masih Sulit tidur. Punggung saya terasa panas, pegal, hangat dan agak sesak nafas kadang kala. Kepala saya pusing sdh dua hari. Lalu jari2 kaki kiri seperti kesemutan dan agak mati rasa bagian kelingking 1 sebelah kiri. Pergelangan kaki kiri juga linu termasuk otot bokong dan paha, kalau ini mgk yoga yg sdh stop lama saya mulai. Ini terjadi pagi atau malam hari. Ini kenapa ya dok? Terima ;insomnia
saya saat ini 38tahun, punya kebiasaan bergadang bahkan bisa tidak tidur selama dua hari dan saya juga masih suka mengkonsumsi alkohol apa dampaknya? selama ini kesehatan saya baik-baik saja dan saja juga aktif donor darah, riwayat penyakit saya yang tercatat dalam ingatan itu sewaktu masih SD dokter bilang gejala tipes, setelah dewasa saya tidak pernah mengalami sakit yang berarti hingga saat ;insomnia
dr. Kenapa ya saya susah sekali untuk tidur malam apalagi kalau sudah lewat jam 12 malam pasti tidak bisa tidur dan besoknya pun tidak merasa mengantuk tapi ketika sore hari sekitar jam 4-5 sore baru merasa ngantuk berat, intinya kenapa mata capek kalau di pejemin ketika malam dok dan susah untuk tidurMohon penjelasannya ;insomnia
dok, saya mau tanya.. saat ini saya sedang menjalani diet, TB/BB saya sekarang 160 cm/70 kg. Saya pernah baca salah satu tips agar diet berjalan efektif adalah dengan tidur cukup selama 8 jam. masalahnya sebelum diet saya sering begadang dan keterusan sampe sekarang saat lagi diet. Saya biasanya baru bisa tidur jam 2 malam dan bangun sekitar jam 9 pagi (total saya tidur sekitar 7 jam). Padahal saya sudah berusaha untuk tidur cepat (jam 10/11 malam sudah mencoba tidur). Yang mau saya tanyakan, apakah berat badan saya bisa turun jika pola tidur saya masih seperti ini dok? trus juga BAB saya ga lancar dok, BAB biasanya sekali dalam empat hari. Saya makan buah dan sayur kok. apa porsinya masih kurang ya? Sekian dulu dok, terima kasih ;insomnia
dok saya wanita 24 tahun, sdh kurang lebih 2 minggu ini saya susah tidur . Berawal dari nyeri perut yg bersangatan setelah nyeri berkurng saya malah tidak bsa tdur malam dengan tenang, dan kalau sdh terbngun malam sngat sulit untuk tdur lagi, saya juga merasa sangat lelah kdang pusing dan nyeri perut saya tiba² kumat . Benar² sangat tdk nyamn aplg beberapa hari ini yg bnr² sulit sekali untuk ;insomnia
dok, begini dok akhir akhir dalam seminggu ini tidur saya mengalami keabnormalan seperti terjaga terus mata saya ... Saya ingin lagi tidur enal seperti sebelum2nya apa obat depresan yg cocok untuk saya dan dosisnya seberapa? Terima ;insomnia
Dok, adik saya sudah sebulan tidak bisa tidur, awal mulanya insomnia ini terjadi adalah ketika adik saya terbangun di tengah malam lalu dia mendengar suara yang mengetuk jendela sampai ketakutan terus sulit tidur sampai sekarang,. Gimana Dok cara mengobatinya udah ke dokter umum tapi gak sembuh, apakah harus ke psikiater?? Mohon ;insomnia
sudah hampir 1 tahun terkena insomnia... tolong dok bagaiamana cara mengatasi dan obat yg bisa sy konsumsi dan tidak berefek ;insomnia
Ibu saya sakit sudah dari hari senin tanggal 6 januari 2020 sampai sekarang tanggal 11 January 2020. Sudah ke dokter tapi belum sembuh juga. Ibu saya mengatakan tidak bisa tidur sudah 6 hari, sudah coba pejamkan mata, matikan lampu kamar tetap tidak bisa tertidur juga disertai panas 38 derajat, batuk, TD: 110/90. Padahal di dalam obat batuknya ada efek samping ngantuk. Terimakasih ;insomnia
berlebihan tanpa sebab, penurunan konsentrasi dan daya ingat, hilang minat dan selalu terbayang kenangan pahit, sering lapar tapi saat berhadapan dgn makanan langsung kenyang atau malah mual, mudah marah dan tersinggung, hampa dan tidak bertenaga, sering melamun dan apatis, sering ngantuk tapi saat mencoba unt tidur malah insomnia, dan saat bangun tidur sama sekali tidak merasa segar, kepala juga sering sakit dan kadang ;insomnia
, kira2 2 bulan belakangan ini sy suka merasa tiba2 pusing dan kalau malam itu sy susah untuk tidur di bawah jam 12. Kalaupun mau cari tidur biasanya sy seperti org yg sesak napas jd sy harus buka pintu padahal kamar sy ber-ac. Kira2 knpa ya ;insomnia
dok, saya aldy 24th saya suka merasa dada sebelah kiri suka sakit kaya di cubit terus kalo mau tidur detak jantung suka kerasa sampai ke kepala terus suka gak bisa tidur kalo pun tidur pasti larut malam tidur nya Kepala juga suka terasa ;insomnia
malam, dokter. Saya ingin bertanya. Saya menderita insomnia sejak Agustus 2019 lalu. Saya kesulitan tertidur, sulit tetap tertidur tanpa terbangun setiap jam, hanya bisa tidur paling lama 3 jam setiap harinya bahkan saya pernah tidak bisa tidur sama sekali selama 3 hari, dan saya merasa kualitas tidur saya semakin menurun.. jadi bulan Desember 2019 lalu saya berkonsultasi ke psikiater mengenai insomnia saya dan saya diresepkan diazepam 2 mg. Tapi, saya tidak merasakan perbedaan ketika mengonsumsi diazepam. Saya juga sedang mengonsumsi lamictal dan sertraline. Setelah saya memgonsumsi diazepam, saya memang lebih cepat tertidur, namun saya juga tetap sering terbangun setiap 1 jam, selalu bangun jam 4 pagi walau saya baru bisa tertidur jam 12 atau 1 malam dan tidak bisa kembali tidur, dan tetap merasa lelah bahkan jauh lebih lelah saat bangun. Saya juga merasa sangat mengantuk di siang hari. Apakah itu efek samping diazepam? Atau dosis diazepam yang saya konsumsi tidak tepat? Atau ada kemungkinan lain yg membuat saya tidak merasakan efek diazepam yang seharusnya? Terima ;insomnia
tanya, ibu saya susah tidur dan batuk terus menerus menyebabkan darting nya naik dan kolesterol jg naik padahal makan di jaga.. obat apa yg cocok untuk darting dan kolesterol nya. ;insomnia
pagi Dokter. Akhir akhir ini saya mengalami kesulitan tidur, saya baru bisa tidur jam 4 subuh namun saya tidur bukan seperti tidur beneran kayak tidur dalam keadaan hidup(?) Apa ya saya sulit menjelaskannnya. Akhirnya saya bangun, saya mengira saya tidur lama berjam jam ternyata hanya 30 menit saja. Dan saya tidur lagi sekitar jam 12an, itupun saya juga ragu buat tidur. Akhirnya saya memberanikan diri buat tidur, hasilnya tidak beda jauh dengan yang tadi, cuman ini hanya 1 jam. Bagaimana cara solusi untuk tidur pada umumnya? Maksudnya tidur normal, 8 jam-an. Terima kasih sebelumnya ;insomnia
memiliki jam tidur yg berantakan dikarenakan pekerjaan saya yg sering mendapatkan shift yg berubah-ubah sehingga saya sulit untuk tidur di waktu yg sama, adanya tekanan fisik dan mental membuat saya makin insomnia tapi saya butuh tidur, tolong rekomendasinya ya ;insomnia
saya ingin bertanya..... Apakah karena tersedak makanan pedas bisa menjadi penyebab gangguan tidur, setelah tersedak, pada jam 21:30 saya berusaha mencoba untuk tidur tapi tidak bisa walaupun hanya sebentar, jam 6 pagi juga tetap tidak bisa tidur walaupun sering menguap.Tolong berikan penyebab dan solusinya dok ;insomnia
dok ibu saya sakit jantung dan udah lama kalo malem itu gak bisa tidur sama sekali,,nah ibu saya ingin bisa tidur gimna cara nya dok tolong kasih tau ;insomnia
dok, mohon ijin bertanya.Ayah saya berumur 73thn, riwayat menyempitan pembuluh darah jantung. Rutin kontrol tiap bulan ke dr sp jantung.Hampir setiap malam beliau mengeluh dadanya terasa perih dan aga susah bernafas sehingga susah tidur.Obat2n yg diminum : Nitrokaf Retard 2,5mg, Miniaspi 80mg, Concor 2,5mg, Ramipril 5mg, Furosemid, Spironolactone 25mg.Anehnya hanya malam dok, kalau siang biasa2 saja..Terimakasih ;insomnia
mahasiswa usia smt 3 usia hampir menginjak 19th. Akhir2 ini saya sering insomnia dan susahh sekali tidur padahal sangat kelelahan. Pikiran saya pun kemana-mana dan selalu overthingking. Kira-kira saya kenapa ya dok?? Apakah ada penyakit serius? Saya tidak ada riwayat penyakit ;insomnia
dok, umur saya 19 tahun saya memiliki insomnia mungkin faktor kebiasaan mengerjakan tugas saya bisa ga tidur berhari hari tapi saya juga memiliki jam tidur tidak normal saya bisa 24 jam tertidur tanpa makan atau ke kamar mandi dan saya juga lebih sering tidur 12 jam terlebih pada saat libur kuliah, gimana yah dok cara penangannya ? Saya juga sering sekali sakit pada daerah belikat kiri kada rasa nya sampe sesak telebih jika di pijat pada bagian belikat kiri sangat sesak dok, resep obat untuk dikonsumsi yang paten apa yah dok atau suntik apa ? terimakasih ;insomnia
saya susah sekali tidur tepat waktu jadi saya hampir tiap hari konsumsi Antimo. dampak kedepannya seperti apa ya dok? dan bagaimana bisa cepat tidur tanpa harus minum ;insomnia
malam dokter,Ibu saya penderita jantung (katup bocor) dan sering susah tidur, apakah ada obat tidur yg aman untuk ibu saya yg bisa didapatkan tanpa resep dokter?Terimakasih ;insomnia
saya susah tidur stlah selasai oprasi batu ginjal Apa kh itu gejala yg wajar ;insomnia
dok 👋Saya orangnya susah tidur tiap malam, bahkan sampai jam 2 dini hari mata masih belum ngantuk juga, padahal mata saya sudah agak perih dan akibatnya kepala saya agak pusing. Tapi dok, siang hari saya ngantuk sekali, walau sebenarnya saya tidak suka tidur siang tapi rasanya ngantuk sekali dan tak tertahankan sehingga mengharuskan saya untuk tidur. Kira2 apa solusi dari permasalahan saya itu dok? Trus apakah ada obat yang bisa saya digunakan untuk mengatasinya? ;insomnia
hampir setiap hari saya mengalami insomnia bahkan kadang saya berpikir tidak perlu tidur , dan saya merasa lebih bersemangat melakukan pekerjaan saya di malam hari .. Kadang saya juga suka mendadak menangis dan ngerasa bhw sy sperti orang yang tdk.berguna /pesimis trhadap diri sendri .Kalau di kelas Bahkan saya sering merasa kalau saya selalu salah di mata teman2 saya . Saya merasa semua anak kelas saya benci ke saya dan mmbuat sya merasa tdk ingin lg berada di kelas tsb.Kadang jg saya klo lg senang suka ga mikir kalo mau apa apa . Suka neraktir temen tanpa alasan sangat boros sma uang .Menurut dokter bagaimana solusinya ya ð terimakasih ;insomnia
Dokaku Rolenta aku mau nanyak nih dok. aku kerja ada shift malam nya. trus knapa ya dok kalo kerja nya udah mau tukar shift pagii pasti ngak bisa tidur. padahal udah dibagi cuti 2hari buat istirahat minta saran nya dok apa yang harus aku lakuin selain cara yang dokter kasih sebelum nya🙏 ;insomnia
dok,saya dari masa remaja sudah merasa ada yang aneh dengan diri saya,seperti memiliki kepribadian ganda tapi bedanya saya ingat apa saja yang 'dia' lakukan tapi sehari setelah kejadian itu.apa ini benar DID apa gimana ya dok.sangat menggangu ini saya juga jadi insomnia akut,selama 24 jam saya hanya bisa tidur 1-4 jam dan saya jadi sering sakit-sakitan ;insomnia
Bertanya mengalami Gangguan tidur (Insomnia) dan saya sering merasa gelisah pada sesuatu yang akan saya kerjakan dikemudian waktu , saya juga selalu merasa cemas pada hal hal yang bersifat tidak penting . Mohon penjelasannya dan apakah saya harus membeli/mengkonsumsi obat penenang? (jika iya mohon tuliskan nama obat dan aturan pakai) Terima ;insomnia
wanita berusia 26 tahun. Satu bulan yang lalu saya dipijat terlalu keras di bagian titi2 saraf kepala, tangan, kaki hingga dada, kemudian saya insomnia karena detak nadi yang sangat cepat setelah dipijat itu. Salahnya orang tua saya malah membawa saya ke pesantren untuk orang-orang yang menderita gangguan jiwa. Lalu ketika di pesantren saya dibawa ke psikiater, tapu oleh psikiater diberi pil koplo, saya konsumsi beberapa hari dan insomnia saya malah makin parah jika tidak mengonsumsi pil tersebut. Saya tidak kuat. Apa yang harus saya ;insomnia
dokterSelamat pagisaya ingin bertanyaMalam ini susah sekali untuk tidur dokKalau bisa di hitung1 malam ini Saya sama sekali tidak tidurBagaimana cara mengatasi hal ini dokter?apakah susah tidur ini akan berdampak ke hari hari berikut ;insomnia
saya mau tanya suami saya sulit sekali tidur waktu malam hari (imsonia) dan suami saya pernah mempunyai riwayat kekurangan darah HB hingga tranfusi darah sampai habisa beberapa kantong. Apakah imsonia dapat mempengaruhi turunnya darah HB? Dan apa obat yang cocok agar sembuh ;insomnia
teman saya tidak bisa tidur sama sekali sdh 3 minggu lebih. Sdh ke dokter diagnosa nya krn pikiran, tensi nya masih normal, tp wajah nya sdh pucat.. Bagaimana saran dokter, phsikolog atau ;insomnia
saya selama 8 tahun mengalami insomnia parah paling parah itu pagi sekitar jam 9 baru bisa tidur lalu saya semakin hari merasa seolah-olah tidak berguna bahkan pernah ingin melakukan bunuh diri dan hingga sekarang perasaan itu selalu saya pikirkan. Dan yang lebih parah sekarang mood saya sering berubah-ubah bahkan ketika marah saya merasa ingin melukai orang. Bagaimana cara agar saya bisa mengatasi mood dan insomnia ;insomnia
dok, perkenalkan saya dengan aldi. Saya mau bertanya dok, saya mengalami sulit tidur dan hanya tidur 2-4 jam dari normalnya org tidur 8 sampai 9 jam dikarenakan saya bekerja dan aktif di malam hari. Saya sudah mengalami 1 bulan terakhir ini, adapun gangguan yg sering muncul seperti masuk angin, pusing, terasa tegang, gangguan pencernaan, sampai gangguan nafsu makan. Mohon solusinya dok, jika harus minum obat, obat apa yg perlu diminum.Terima kasih ;insomnia
doksaya Ovalindu 27thakhir2 ini susah tidur, kalo tidur sering terbangun tengah mlm dan gabisa tidur lagi sampai pagi, terus ada rasa bergerak juga dlm perut diatas pusar , membuat saya semakin cemas dan ketakutan . saya sampai takut tidur , takut mati , takut berlebihan dan selalu gelisah mohon solusi nya dokter ;insomnia
dok saya mau bertanya, kenapa saya selalu tidur hanya 4 jam? padahal saya sudah berolahraga secara rutin. Apa saya perlu konsumsi obat tidur? Saya dulu sempat mencoba mengkonsumsi Valdros, tapi tetap tidak ada hasil. Terima kasih ;insomnia
, 8 bulan terakhir ini jam tidur saya rusak parah. Yang dulu biasanya saya tidur 7-8 jam sekarang gabisa tidur kayak gitu lagi. Mungkin ada solusinya dok? Misalnya saya tidur jam 8 malem saya pasti bangun 1 jam 30 menit - 2 jam kemudian yaitu jam 10 malem , dan saat itu keadaan masih ngantuk berat juga tapi gabisa tidur lagi walau udah tutup mata dan mencoba tidur selama 3 jam dan gagal. Lalu saya coba Tidur jam 9 malem ternyata kejadiannya terulang Saya bangun jam 11 malem dalam keadaan mata perih , kepala pusing dan masih ngantuk tapi gabisa lanjut tidur. Akhirnya saya undur terus sampe jam 1 pagi pun saya bakal bangun jam 3 pagi. tapi anehnya kalo tidur setengah 3 pagi itu bisa bangun normal 7-8 jam. Ada solusinya dok? Kalo jam tidur segitu kan mengganggu aktifitas pagi saya , yang tadinya normal mohon bantuannya dok. Saya ke puskesmas mana pun kalo saya konsultasi jawabannya cuman karna saya kebanyakan main gadget padahal sudah saya batasi 1 jam tiap hari. Mohon bantuannya ;insomnia
dok, anak saya berusia 5 tahun 11 bulan. Sudah beberapa hari ini ia tidak bisa tidur siang dan mlam... Kira kira apa penyebabnya ya ;insomnia
dok ,beberapa bulan ini saya sedikit aga pemarah ?saya sering berhayal,pura pura bahagia di depan semua orang di depan keluarga.terkadang merasa terpuruk susah tidur apakah ini salah satu gejala ;insomnia
dok, saya punya seorang teman. beliau dulunya 1 hari dapat mengkonsumsi kopi 3-6 gelas dalam sehari, dan biasanya tidak mempengaruhi kondisi belakangan ini setelah dia meminum kopi 1 gelas saja, menyebabkan dia tidak dapat tidur baik di siang hari ataupun malam teman saya itu sekarang telah menjadi seorang manajer disebuah perusahaan swasta, sibuk dan pekerjaan nya lumayan banyak, yang jadi pertanyaan saya, apakah kopi yang dia konsumsi ditambah dengan tekanan pada pekerjaan terdapat hubungan yang menyebabkan dia tidak dapat tidur? terima ;insomnia
alodokter,,apakah susah tidur adalah termasuk salah satu yg bisa menyebabkam ;insomnia
sudah hampir 11 tahun, kebiasaan begadang yang saya lakukan ini. Saya ingin sembuh dan punya pola tidur normal. Di mulai dari usia 9 tahun saya sudah mulai begadang di depan televisi. Hingga sekarang sepertinya 'begadang' adalah keharusan bagi saya. Apalagi game online yang selalu saya lakukan disetiap kesulitan tidur dalam bbrpa taun terakhir. Mohon jawabannya Dok. Bila perlu. Saya akan berkonsultasi lebih lanjut. Terima kasih ;insomnia
"pagi, doksebelumnya tentang saya ; perempuan, baru menginjak umur 17 tahun dibulan agustus kemarin.Waktu umur saya 16 tahun, saya memberanikan diri untuk melakukan konseling di salah satu puskesmas jakarta pusat. Hasil dari konseling tersebut, saya diberikan obat Amitriptyline untuk insomnia saya dengan dosis 1x1 setiap malam. Tapi terkadang 1 tablet setiap malam tidak mempan untuk saya, jadi saya meminumnya 2 tablet pada malam hari. Lalu saya sudah lebih 2 minggu tidak mengonsumsi obat amitriptyline lagi, dan kemarin saya merasa sangat lelah dan merasakan kantuk yang tidak bisa ditahan padahal saya tidak mengonsumsi obat amitriptyline atau obat lainnya yang memiliki efek samping kantuk. Apa ini ada hubungannya karna saya mengonsumi obat amitriptyline melebihi dosis yang ";insomnia
dok, saya ugii berusia 22 tahun. saya ingin bertanya mengenai masalah tidur yang saya alami. sudah beberapa tahun berjalan saya mengalami masalah ini setiap malamnya, saya mengalami bangun tiba2 ketika sedang tidur jika mendengar suara2 bahkan kadang2 terkejut, walau pun saya sudah tertidur berjam2 lamanya. bahkan saya bisa langsung terbangun ketika ada serangga kecil yg berjalan di atas tempat tidur saya. menurut dokter, apakah itu termasuk suatu gangguan tidur atau semacamnya ? terima ;insomnia
saya mau tanya, kenapa ya saya kalau tidur tidak pernah nyenyak. Ada tips g dok supaya tidur nyenyak? dan ketika bangun badan dan pikiran ringan seger ;insomnia
"dok,nama saya Dian Ismi Rahayu.Saya tidak mengerti,saya merasakan sesuatu yg aneh akhir akhir ini. Umur saya 19 tahun,saya bekerja di salah satu restauran ternama di indonesia. Jadi awalnya,sy memiliki gangguan insomnia sejak sy masih bersekolah,sy fikir itu hal yg biasa. Setelah sy bekerja dan menghabiskn banyak waktu di tmpat kerja,fikiran sy sangat kacau. Insomnia semakin mnjadi jadi,ditambah sy prnh di marahi senior sy di tmpat kerja,dan itu membuat sy trauma,ketika bertemu dgnnya sy sangat ketakutan dan skrg sy tdk mau melihatnya, hari berlalu,sy membuat kesalahan lg dan di marahi oleh atasan saya, bahwa sy sangat di remehkan olehnya,saya takut utk bertemu dgnnya ;( sy sempat menangis di depannya,tp dia malah berbicara bahwa saya baper,dan itu m mbuat sy shock.hal hal aneh mulai muncul,yg pertama sy sering pusing meskipun sy sudah makan,rambut sy sangat rontok pdhl memakai shampo yg sama, insomnia smkin menjadi,susah makan dan tidak teratur,terkadang fikiran sy kacau dan sy hanya ingin menangis. Saya takut,curhat kpd teman trdekat tetapi mrk sllu menganggap ini biasa,dan sy sangat ";insomnia
dok saya ini tiap hari sering gantuk bagaimana ya dok apakah ada kelainan dalam tubuh ;insomnia
berumur 17 th.dulu saya pernah mengalami kekerasan saat smp yang mengakibatkan trauma hingga saya sma . Lalu saya mengalami depresi dari trauma tersebut. Semakin lama malah saya jadi susah sekali untuk tidur di malam hari (insomnia) apakah insom tersebut pengaruh dari depresi yang saya ;insomnia
dok saya mau bertanya obat tidur yang baik di komsumsi bagi kesehatan apa ya dan hanya untuk tidur beberapa jam saja? Saya punya pengalaman setelah minum obat emang si biasanya langsung tidur contoh saya tidur jam 6 malam itu setelah minum obat kemudian tidurnya sampe pagi, tetapi setelah keesokan harinya saya jadi susah tidur lagi itu bagaimana ya ;insomnia
dok, saya sering mengalami gangguan tidur mulai dari sleep parylist, insomnia, dan yg baru baru ini seluruh kepala seperti mau pecah/tegang dok hingga gigi terasa ngilu semua seperti mau rontok. Dan itu terjadi saat saya mulai tertidur. Atau masih setengah sadar, dan sementara mata saya sulit sekali untuk bangun, tapi kalau saya tidak segera bangun, kejadian tadi akan terjadi lagi. Ini sering terjadi dan hampir setiap hari dan Ini membuat kualitas tidur saya menjadi kacau. Apa yg sbenarnya terjadi dg diri saya dok?? ;insomnia
sering mimpi buruk, mengantuk disiang hari, ketika berbaringlangusng mengantuk, tapi tidur saya tidak nyenyak, bangun tidur badan lelahApa yang terjadi pada saya dokter? Mohon bantuanbantuannya ;insomnia
dokter, saya mau bertanya, saya sudah lama sulit sekali tidur, bisa tidur tapi selalu diatas jam 12 malam dan terkadang terbangun ditengah-tengah jam tidur saya dengan keadaan berkeringat dan jantung brrdetak kencang. Selalu memikirkan hal2 secara berlebihan dan membuat saya mudah marah dan tersinggung dengan perkataan orang lain terhadap saya, atau terkadang menangis tanpa sebab. Selama ini ketika saya cemas,khawatir,stres selalu saya hilangkan dengan merokok,minum alkohol atau terkadang pergi berolahraga. Ada apa dengan tubuh saya dan Bagaimana solusinya dok? Terimakasih. (Saya perempuan berusia 20 ;insomnia
dok..saya ingin bertanya kenapa akhir2 ini ketika saya sdh mulai memasuki bulan terakhinya saya merasa susah tidur,mual dan bagian telapak kaki saya selalu terasa panas saat malam ;insomnia
ingin bertanya dok, sudah 3 bulan saya di suntik sikzonoate, dan bulan ke 4 tidak suntik lagi, dan saya mengalami efeksamping dari obat tersebut yaitu insomnia, yg saya ingin tanyakan, berapa lama efek samping insomnianya hilang??... dari bulan 1 sampai 4 saya di beri obat ;insomnia
dokter, sudah delapan bulan saya mengalami kesulitan tidur atau tidak bisa tidur dan tidak pernah mengalami ngantuk lagi.Awal gejala kepala saya terasa berdenyut-denyut sakit sekali, dan beberapa bulan kedepan kepala saya masih berdenyut sakit tapi Alhamdulillah sudah merasa baikan. 24 jam saya terus tidak pernah mengalami ngantuk lagi, jika saya tidur itupun saya tidur seperti tidur ayam.Sebelumnya saya sudah pernah ke dokter jiwa dan saraf, lalu saya diberi obat tidur hari pertama saya tidur, dan hari keduanya obat itu tidak ngaruh sama sekali kepada saya, sampai bulan kedelapan ini saya masih merasakan seperti ini, mohon saran nya dokter untuk penyembuhan saya. Semoga Allah menyembuhkan penyakit saya ini aamiin, karena saya ingin normal ;insomnia
dok. Kami mengalami insomnia dok karena gelisah sama ketakutan dok. Itu boleh langsung minum obat tidur apa tidak ya ;insomnia
