kalimat;tag
dok, saya mau tanya, setiap saya tidur dimalam hari itu kenapa ya perasaan itu kayak ga tenang, mudah paranoid, mood naik turun.... dan itu ada efeknya buat besok, pas besoknya itu mood malah jadi susah naik dan selalu bad mood seharian, itu kenapa ya ;insomnia
ini saya sering merasa stres terutama sejak mantan membentak saya dan kepercayaan yang sudah saya berikan ke Tante saya.ternyata diingkari.ibu saya selalu menuntut saya cepat lulus.tampa bertanya kondisi saya.dan saya terbiasa dari kecil untuk harus bisa mendapatkan apa yang ibu saya inginkan.pada saat kecil hingga remaja.saya mengalami kdrt dari ayah saya.Saya tidak bisa tidur nyenyak.sekali tidur,tak ada mimpi yang saya alami.badan saya selalu merasa pegal.padahal saya sudah pijat refleksi.sering tiba2 ingin menangis.teriak.marah.tertawa.dan ingin bunuh diri.saya juga sekarang mengalami kesulitan untuk berkomunikasi dengan orang lain.saya selalu merasa takut tanpa ;insomnia
dokter... saya wanita berusia 25 tahun. Kemarin saya hbs terkena diare yg membuat saya lemas hingga tensi 80/60. Sekarang udh mendingan karena tidak muntah saya tidak jadi opname. Tapi setelah diberikan obatnya saya ga bsa tidur dok. Apa kandungan obat diare ada yg membuat tidak ngantuk ya dok? Pdhl perut sudah tidak melilit dan sudah tidak bolak balik ke kamar mandi. Terimakasih penjelasannya dok ;insomnia
dok, permisi saya ingin bertanya... Ketika seseorang sedang mengidap penyakit insomnia gejala2 fisik apakah yang terlihat oleh pengidap insomnia tsb? dan saya baca2 dari artikel terdapat jenis2 insomnia yang berdasarkan dari penyakit yang bersarang dalam tubuh atau bukan, apakah benar dok? dan apakah mata merah juga merupakan tanda-tanda seseorang tersebut mengidap insomnia? Terimakasih ;insomnia
siang doksaya mw nanya, saya udah 2.hari ini suka ngantuk di jam kerja sayah lebih tepatnya di pagi hari penyebabnya apa ;insomnia
penderita nasofaring dan sudah selesai sinar dan kemo keluha saya badan saya sekarang pegal linu dan sudah ada sebulan Bagaimana itu dokter ;insomnia
siang dok,saya mau tanya suami saya sering sekali mengalami susah tidur,sehingga mengakibatkan kepalany sakit,bagaimana mengatasi nya dok,, ;insomnia
susah tidur semenjakk kerja tahun 2017, dan akhir akhir bulan ini saya SETIAP HARI susah tidur nyari posisi yg nyaman buat tidur juga susah, biasanya tidur jam 3-4 pagi sekarang bisa tidur jam 6-8 pagi.. Jam tidur saya terbalik.. Pagi buat melek siang buat tidur.. Saya lagi gak ada kegiatan. Jam tidur saya 5/6 jam. Tidak tidur siang, tidak minum kopi. buang air besar kadang tidak lancar, Saya khawatir klo saya susah tidur bertahun tahun (mau masuk 3thn) nanti saya ngalamin sakit parah bagian organ tubuh saya yg tidak ;insomnia
istri saya umur 23 .saya mau tanya beberpa hari ini istri saya susah tdur dan sellu pikiranya bingung tolong kasih solusi ;insomnia
dok saya mau tanya kenapa ini saya kalo tidur hanya beberala jam dan stiap malam terbangun lalu menunggu pagi lagi baru bisa tidur yah dok dan saya suka merasakan nyeri di dada kiri sampe belakang ;insomnia
dok, saya mau tanya, kakak saya sekarang sulit tidur. Sudah sejak 2 hari yang lalu tidak tidur sama sekali. Akhir2 ini juga sering unmood dan sering berfikir negatif, sekarang pun dia pusing, sepertinya efek tidak tidur 2 hari. Dia sudah minum obat apa saya lupa, intinya ada efek ngantuk. Dia bilang juga ingin tidur, tapi tidak bisa. Sudah dipaksa daritadi. Sebaiknya ;insomnia
pagi dok , saya mengalami masalah tidur sudah lama , apakah mengkonsomsi obat tidur *Lelap* aman untuk saya , tapi akhir akhir ini saya tidak merasakan bahwa obatnya bekerja , saya masih tidak bisa tidur lelap , namun saya kelelahan , meditasi dan menghindari gadget sudah saya lakukan , apakah ada rekomendasi obat untuk saya yg bisa saya beli di apotik dok ? Atau adakah hal yg bisa saya lakukan tanpa harus pergi ke dokter setempat untuk masalah tidur spt ini ;insomnia
pak atau bu dokter Saya merasakan cemas dan gelisah takut sekali ...Dan badan badan syaa muali dingin dingin bu dokter Apa yang harus aku lakukan Waasalam ;insomnia
dok, sudah hampir sebulan belakangan ini saya mengalami susah tidur (insomnia) padahal sudah coba merilekskan tubuh saat mau tidur, coba minum obat tidur (merk Lelap) tapi hasilnya tetap juga tidak bisa tidur saat malam hari. Dan saya jadi lebih sering sakit kepala dan leher tegang. Apakah ada rekomendasi obat atau cara biar bisa kembali normal? Jujur saya tersiksa dengan pola seperti ini. Terima kasih ;insomnia
terhormat Dokter, Selamat beberapa minggu saya mengalami gangguan tidur, kadang keadaannya jadi lbh berat kalau sudah terlalu capek, saat badan sudah ingin pulas tiba2 agak tersentak membuat saya dalam keadaan bangun, itu terjadi berkali-kali saat sedang gangguan, sehingga jadi membuat stress/cemas/memikirkan hal2 yg negatif. Saya juga masih bingung apa dari insomnia menimbulkan stress, atau stress menimbulkan insomnia. Apa ada hormon ttt saya yg tidak seimbang, sehingga membuat saya gangguan tidur. Bagaimana saran dokter, apakah saya harus ke dokter internis atau catatan hal ini sudah konsutasikan ke dokter spesialis syaraf dan dokter sudah memberi obat tidur, obat itu rutin saya minum sesuai anjuran, saya sudah coba lepas dari obat tersebut namun masih belum bisa, jadi seperti ketergantungan, saya juga sampai melakukan CT scan + contrast (bagian kepala), dan hasilnya tidak saran dan jawabannya, terima kasih ;insomnia
dok, saya mau tanya.. Pada dasarnya pola tidur saya memang selama ini tidak baik, selalu tidur diatas jam 12 malam. Tapi sudah seminggu ini kurang lebih, badan saya merasa sudah lelah sekali tetapi walaupun sudah tiduran dan memeramkan mata saya masih susah sekali untuk tidur. dan baru bisa tidur kalau sudah jam 9 pagi. Tidak tahu kenapa.Apakah perlu saya minum obat tidur? Terimakasih ;insomnia
dok, saya mau tanya. Sebelumnya saya sakit demam, kemudian saya berobat setelah makan obat saya merasa tidak cocok dengan obat yang diberikan. Efeknya jadi susah tidur dan membuat saya mengalami halusinasi dan merasa tubuh saya menjadi hampa. Dari situ saya memberhentikan konsumsi obat. Setelah deman saya membaik, lutut dan pergelangan tangan saya terasa sakit seperti memar tp tidak ada bentuk memarnya. Mohon penjelasannya ;insomnia
good day dr. Saya Riza , laki laki 24 thn.Saya mau bertanya.Apa syaa butuh psikiater atau tdk.Sesuai artikel , saya termasuk kdlm nyaEmosi , swing mood , alkohol dan kecanduan paramex. Dan insomnia berlebihan. Dan jg sering ngejawab sesuatu yg berbicara di kepala saya. Pernah mikir buat suicide , tpi kya nya ga worth it sih. Dunia kya nya masih bisa di nikmati.BtwSaya tau maslh sya.Saya bermasalah di managemen keuangan. Mngkn krna income saya pas2an dgn life style saya.Jdi kalau saya ke psikiater , saya berasumsi akan disuruh olahraga dan berlibur. Whichis mengeluarkan biaya lagi. Jadi makin stres. Inti nya saya stres.Apa yg saya lakukan ;insomnia
menderita Depresi hingga mwngalami amnesia disosiatif 3 minggu yg lalu. Sekarang saya mengkonsumsi obat merlopam dan fridep. Tapi saya mengalami insomnia. Apa yg harus saya ;insomnia
Dokter, perkenalkan saya bulan oktober tahun 2018, sy melakukan medical cek up. dikarenakan 6 bulan sebelum oktober 2018, sy merasakan badan sy sering capek dan drop. Kadang ketika mau tidur, sy malah tidak bisa tidur, karena saat badan udah mau masuk fase tertidur, seakan2 sy seperti ditarik untuk bangun lagi, jantung kadang berdebar2 dan perut mulas, terus ada sensasi serr-serr seperti orang naik roller sy takut sy ada sakit jantung, Maka saya melakukan cek up. hasil cek up menyebutkan kalau jantung saya baik2 aja, dan dari tes jantung yang jogging sy di sebut tidak apa2 jantung nya, hanya kebugaran sy yang payah. dan hasil lab menyebutkan kalau sy ada kolesterol dan asam urat yang tinggi. sedang gula saya normal. maka sy minum obat penurun kolesterol dan untuk sensasi yang sy sebutkan diatas masih belum berkurang. sy berkonsoltasi ke doktaer katanya sy ada maag. makanya sy minum obat maag semacam antasida, ranitidine, omeprazole. Gejala2 tsb sih masih ada sampe sekarang, kalau lagi menyerang , perut sy mulas, dan sy kebelet pup dan pup bisa dikeluarkan walau kadang cuman sedikit. Kadang sy juga keliyengan, kalau sy pas duduk suka seakan2 seperti limbung kaya mau pingsan. sama 1 lagi, tenggorokan sy ini banyak banget dahaknya dok. kadang pas mau tidur malah membuat sy sempet berhenti nafas gara2 kaya kalau gejala itu menyerang sy minum omeprazole. 2-3 jam kemudian sih sepertinya agak sy tidak pernah seperti ini. dulu saya sangat aktif berolah raga, dan sudah 3 tahun ini berhenti total karena kesibukan kawatir apakah organ dalam sy ada yang bantuan / saran nya ;insomnia
awalnya sakit lambung..setiap makan selalu muntah kemudian saya periksa ke puskesmas dan diberi obat..nafsu makan saya kembali seperti dulu. Kemudian kambuh lagi dan saya periksa ke bidan lain dan diberi obat. Tapi setelah minum obat malah mual dan saya tidak bisa tidur sama sekali dok..sudah 2 hari full saya tidak bisa tidur. Gimana caranya saya bisa tidur lagi ya dok saya juga kerja shiftmalam soalnya ;insomnia
dokter saya mau tanya!Ini orang tua saya sakit, umurnya sekitar 50thn.Setiap hari kondisi badannya kedinginan, nafas sesak, kalau tidur malam gak bisa nyenyak.. hampir gak bisa tidur klw malam! Minta solusinya dok, trima kasih ;insomnia
akhir ini saya suka begadang hingga pukul 4 dini hari. Cara mengatasi nya gimana ;insomnia
dok, saya 21 tahun. Sekarang sering merasa kelelahan yang berlebihan meskipun tidak melakukan kegiatan yang berat. Kemudian, saya sering mengantuk. Beberapa makanan di beberapa tempat tertentu meskipun menunya sama tapi tidak bisa saya makan, semisal tempat x memasak nasi goreng, tempat y juga, tapi saya tidak bisa memakan apapun di tempat x meskipun menunya favorite saya. Selain itu, terkadang di malam hari saya sering menangis tanpa sebab, kemudian stress dan akhirnya tidak bisa tidur hingga pagi. Apa yang harus saya lakukan dok ;insomnia
dokk,sebelumnya saya memiliki beberapa pertanyaan..saya memiliki gangguan tidurr atau insomnia,dan saya ingin menggunakan obat tidur,dan jika menggunakan obat tidur apakah ketika kita tidur jika dibangunkan kita akan bangun?atau kita akan bangun dengan sendirinya??berapa lama waktu tidur yg kita dapat stelah mengonsumsi obat tidur? Dan efek apa saja yg ditimbulkan? ;insomnia
Saya Mau Tanya Kenapa Ya Saat Saya Mencoba Tidur Saya Kesulitan Karna Seperti Pikiran Saya Atau Keluar Random Memori Jadi Saya Seperti Mendengar Suara Temen Saya Atau Saya Berfikir Yang Saya Alami Atau Seperti Bercerita Sendiri Saya Bingung Kepala Saya Seperti Berfikir Trus Dan Ini Terjadi Paling Sering Saat Saya Tidur Malam Dok Jadi Membuat Saya Sulit Tidur Dan Hingha Bergadang Sampai Pagi Tolong Infonya ;insomnia
siang Dok, saya remaja berusia 18 tahun dan saya ingin bertanya. Belakangan ini saya mengalami sulit tidur dok. Pada saat malam sudah larut pun saya sulit untuk mengantuk, menguap pun jarang. Padahal dulu saya tidak begini dok. Dulu kalo saya merem, tau tau udah subuh gitu dok. Sekarang tidak, saya merem, tapi saya tidak tidur tidur dok. bawaannya pengen terjaga gitu. Meremnya lamaaa, baru tertidur gitu dok. Itu kenapa ya dok ? Terima ;insomnia
dok saya selalu tidak bisa tidur pas malam hari tetapi kalau saya sudah tidur, saya bisa tidur kira2 10-12 jam, kalau belum segitu saya tidak bisa bangun. apakah itu salah satu gejala ;insomnia
dokter sudah hampir 2minggu ini saya sangat sulit tidur,malam kalau tidur sekitar 2jam saja terus jam tidur nya jam 1 malam atau jam 2 malam...dan siang juga susah sekali tidur padahal mata ngantuk dan kepala sakit...itu kira-kira kenapa ya dok ? ;insomnia
dok.. apakah obat clozapine aman untuk dikonsumsi penderita insomnia dan selalu berhayal.? Terimakasih ;insomnia
Dokter! Saya sering banget ngerasa pusing dan susah tidur. Dan ketika minum obat sangobion itu pasti diare. Minta tolong rekomendasi kan obat anemia yang cocok untuk gejala ;insomnia
bgaimana ini dok sya blum tdr2 dri malam smpe skrang ini,stiap sya atur posisi yg nyaman ttep tdak bsa dn sya td mncoba mndi subuh2 spaya sya bsa nyaman tdrnya ttapi nihil donk😭😭 sya slalu bgini donk wlaupun smpat tdr smbentar tp nnti mlam trulang lg.. Apa sya hrus mnum obat yg ada efek ngantuk nya dok.. Mohon pnjelsannya ;insomnia
dok, sdh 2 hri yg llu orang tua saya mngkonsumsi obat jantung stlh mminum obat tersebut mlh ssh tdr dan badany kty trasa pnas tiap mlm..Apa tu efek smping dri obat tersebut! mhon pnjlsany ;insomnia
dok .nama saya ADITYA saya seorang siswa pelajar di SMK kelas 2 .begini dok belakangan ini saya sering lambat tidur di karenakan pekerjaan mengetik di depan komputer dan besok nya saya harus bangun pagi untuk berangkat sekolah saya mau tanya berapa jam tidur IDEAL untuk remaja seperti ;insomnia
dok, saya ingin bertanya lgi.Sudah 2 hari ini saya tidak tidur sama sekaliDulu memang pernah insomnia, tapi nanti pukul 2 dini hari akan tertidur. Tapi kali ini saya sama sekali tidak tidur, tapi merasakan kantuk. Saat saya berbaring, badan saya seperti kaget dan akhirnha tidak bisa ;insomnia
mlm dok ingin nanya?saya susah tidur kdang jam 4 pgi bru tidur ,teman saya bilang makan obat dexta forte kapsul ,mknya 10 butir mian akan cepat tidur, saya beli di apotek satu papan dan sya makan semuanaya ,ternyta benar dok ,bisa cepat tidur ,tp siang jga tiur bawaanya sampai besoknya bawaannya jngin tidur terus, apakah tu bermasalah ;insomnia
dok pengen nanya .. ini ibu saya dia tdak tidur selama 4 hari. dia sudah berobat kedokter dan kata dokter kesehatanyaa baik darah ya normal . dan itu udh dikasih obat tidur juga tidak ada reaksi . gimana cara ya dok supaya ibu saya bisa tidur . saya sedih melihatnyaa ;insomnia
saya mau bertanya..dulu saya waktu sekolah kan pernah sakit saraf dan dibawa ke rsj magelang dan pernah dirawat inap gara2 saya merasa bingung dan pernah hilang ingatan.. kata dokter spesialis atau psikolog di magelang jangan sampai putus obat tetapi sudah 2 tahun saya tidak lanjut kontrol lalu sekarang akhir2 ini merasa cemas, depresi dan kurang tidur. Apa memang benar penyakit saraf iitu memang sembuhnya lama? sayavsudah putus obat sudah cukup lama dan tidak bilang ke dokter kalau mau berhenti kontrol dan mengambil resep dokter, bagaimana ;insomnia
saya mau bertanya? Saya ingin menggunakan obat tidur krna saya insomnia kya obat bius klo saya gunakan ketika saya dibangunkan istri saya bisa atau ;insomnia
dokter akhir-akhir ini saya susah tidur kadang bisa tidur kalau jam 3 subuh dan saya tdk tau apa penyebabnya ini diwaktu siang pun bgitu susah mau tidur ;insomnia
terkadang suka susah tidur, tidak tau apa sebabnya. Saya biasa tidur sekitar jam 10 malam, rasa kantuk ada, tapi saat mata di pejamkan, saya tidak bisa tidur dengan lelap, saya masih bisa mendengar suara2 apapun yang kalau saya tertidur lelap dan terbangun dgn sendirinya sekitar jam 3 pagi, kalau sudah seperti ini saya tidak bisa tidur bantuannya,.......... apakah ada obat mungkin adakah obat herbalnya ;insomnia
dok, saya mau tanya, ibu saya kepalanya sakit dan terasa dingin dibagian atas belakang , dan ibu saya susah untuk tidur. Itu apa penyebabnya dok, dan bagaimana cara mengatasi ;insomnia
bayi saya sdh 31 hari, sering kali sulit untuk tidur malam, segala cara dilakukan misal ditimang2 tertidur tp ketika diletakkan di tempat tidur seperti kaget dan terbangun lagi, dan bisa berlangsung sampai hampir dini hari, tp selepas magrib sampai 2 atau 3 jam kedepan dia bisa sangat lelap tidur, normalkah dok?memang aktivitas tidurnya masih sering terganggu karna sering ;insomnia
dok, saya putra, saya ingin bertanya dok 3minggu lalu saya sakit demam tinggi disertakan muntah parah dok setelah sembyh dari demam dan muntah dok saya di diagnosis terkena stress dok, tapi kenapa dok setiap saya mau tidur jantung saya selalu berdebar sangat kencang disertai kedutan dari seluruh tubuh saya sampai sampai saya hanya tidur 2-5 jam sehari dok dan itu juga saya tidur selalu di pagi hari dok, setiap saya ingin meram saya selalu merasakan denyut nadi dikepala kaki,perut,paha dll sampai membuat saya keringat dingin dan saya tidak tidur tidur dok, saya takut mengidap penyakit serius dok, saya berfikir ini gejalah akan segera tiba waktu meningal saya dok apa solusi dan obat nya yah dok tolong bantu saya ;insomnia
dok, saya perempuan usia 22 tahun, saya mau nanya dok, saya ini susah sekali tidur siang, karena terlalu peka terhadap suara, dan jika dipaksakan pun walau mata saya lelah tetep gabisa tidur dok, kalopun saya bisa tidur siang, tidur malem saya pasti susah dok. Jika ada hal yg menganggu ketika beraktivitas, ada masalah kecil, yg membuat marah, yg membuat cemas, malemnya saya sulit sekali tidur karena hal2 yg terjadi itu mengganggu dan terus saja terpikirkan, padahal mata saya sudah ngantuk dan lelah sekali, tp tetap saja sulit untuk tertidur. saya juga mudah sekali marah, sampai emosi saya meledak2, sampai teriak2 setelah itu saya sangat menyesal tp saya tidak bisa nahan emosi saya dok, pdhal hanya masalah kecil saya bisa emosi berlebihan . Dari keluhan saya diatas menurut dokter saya harus bagaimana? ;insomnia
saya sering tidur malam ya dok? pasti di atas jam 11 malam, padahal saya masih sekolah. apa dampaknya bagi kesehatan saya dok? ;insomnia
susah sekali untuk tidur,keinginan saya untuk bisa tidur cepat dan teratur tiap malam.Apa obatnya dok ;insomnia
dokter, di hari sabtu tgl.9 mar' 19 ini saya melakukan operasi pengangkatan rahim.Sejak hari itu sampai hari ini saya tidak bisa tidur baik disiang hari ataupun dimalam hari, meskipun mata saya terasa berat tapi tetap tidak terlelap, apa penyebabnya ini dokter, apa solusinya, ;insomnia
knp ya insom saya ga ilang ilang hampir setiap mlm saya ga prnh tidur dan selalu tidur jam 10 pagi. Itupun saya bangun paling jam 3 sore abis itu uda ga tidur lg. Cara ngilangin nya gmn ya dok mohon solusi ;insomnia
Dok, bayi saya dari usia 3 Minggu susah tidur kalo mlm. Kebanyakan orang bilang setelah 40 hari tidur bayi akan normal tapi sampe saat ini usia bayi saya 5 bulan 9hari tetap saja pola tidurnya jelek. Jam 8 atau jam 9 malem dia tidur nanti kebangun sekitar jam 11 atau jam 12 keatas setelah itu dia susah buat tidur lagi malah asik main sampe subuh baru dia mulai ngantuk. Dan itu setiap hari seperti itu Dok... Bagaimana yaa mengatasinya agar pola tidurnya kembali normal ? Terimakasih sebelumnya Dok ;insomnia
saya mau tanya, bila saya ingin membuat 1 produk dimana produk tersebut berisi 1- 5ml alkohol 70%, 2- 20 drops essensial oil, 3- 1/2 sendok teh magnesium flakes, 4- air secukunya hingga produk 100ml, apa ini baik bila terhirup dok? mohon solusi ;insomnia
dok, saya sudah beberapa bulan terkena gastritis dan telinga kiri saya terasa mendengar suara yang tinggi saya sudah berobat ke beberapa dokter umum dan penyakit dalam tapi masih belum sembuh juga, dan akhir-akhir ini kembali saya merasa tidak enak badan terasa merinding, mual, lemas, lemah, pandangan kabur serasa mau pingsan beberapa jam sebelum BAB, itu kenapa ya dok?Saya juga jadinya merasa patah semangatTidur saya juga tidak bisa lelap, mohon bantuannya ;insomnia
hal makan pun, saya hanya bisa menyantap sedikit sekali.. Kalau berlebihan, akan terasa sesak dan tidak enak.. Kalau makan di luar, ukuran seporsi itu, saya cuma menghabiskan separuhnya saja.. Jika ingin menghabiskan seporsi tsb, maka saya tidak makan 3 hari baru lah habis.. Tapi kadang masih terasa sesak.. Serta perut saya sering kembung, terbukti dengan bunyi gendang saat menepuk ;insomnia
malam dok,Saya bekerja dgn sistem shift. Jam tidur saya tidak menentu, tp udah seminggu belakangan saya tidak bisa tidur di malam hari hingga ke siang hari esok nya. Apakah saya mengalami gejala2 insomnia? Dan jika ya, serta saya mau diperiksa, saya harus ke dokter bagian/spesialis apa ;insomnia
saya ingin bertanya. Saya punya keponakan berusia 3th dan dia sulit tidur pada malam hari katanya sebelunya anak tersebut sering bermain hp sebelum tidur apakah itu salah satu penyebabnya anak sulit ;insomnia
dokter, dokter saya mau tanya belakangan ini sudah satu bulan lebih saya mengalami sakit dimna otak saya tidak beristirahat. Saya kira insomnia tapi sepertinya bukan, Kenapa ya dokter penyebab nya apa. Tolong saran dan solusinya dokter, ;insomnia
saya sangat susah tidur di malam ;insomnia
saya afrizal mau bertanya. Saat saya sedang sakit radang tenggorokan, dokter klinik dekat rumah saya memberi omegesic, orphen, obh, licodexon, paracetamol, dan amoxilin. Setelah penggunaan obat tersebut alhamdulillah sakit saya sudah berkurang, tetapi saya jadi sulit tidur, kadang semalaman saya mencoba memejamkan mata dan mencoba tidur. Tetapi tidak bisa tidur. Sehingga saat pagi, kepala sedikit pusing kurang tidur. Apa ini efek dari obat yang saya konsumsi, atau efek dari sakit yang saya derita. Terimakasih ;insomnia
pagi dok, saya punya seorang nenek yang akhir-akhir ini jarang tidur dan nafsu makannya tinggi sekali. Dalam 1 hari bisa makan sampai 5-6 kali. Seharusnya bisa lebih dari itu kalau tidak dikontrol. Beliau ini kalau disodorkan makanan apapun pasti mau walaupun sudah makan. Sudah makan pun masih tetap lapar dan tidak ada kenyangnya. Waktu laparnya pun random bisa saat tengah malam atau dini hari. Sedangkan kondisi beliau hanya di tempat tidur saja, tidak ada gerak sama sekali. Bukannya berbahaya ya dok? Apa ya penyebabnya dan apa ada hubungannya dengan susah tidur? Terima ;insomnia
saya Anit umur 18+ mau tanya,kenapa pas mau tidur mata udh merem tapi fikiran selalu melayang kemana² dan lama banget ke tidurnya kadang suka agak pusing juga. Itu kenapa ya?depresi bukan?atau ;insomnia
dok. Saya ingin bertanya apakah ada efek tertentu bagi ibu hamil yang sulit tidur saat malam hari. Bahkan kadang tidak tidur. Bisa tidur hanya menjelang shubuh saja dan berlangsung berbulan bulan sejak awal hamil hingga saat ini mencapai umur kehamilan hampir 8 bulan dok ?. Terima kasih ;insomnia
dok.. Mau tnyaa, kenapa yaa bayi saya klo rewel saat tidur SSH didiamkan Dan mesti cari mimik? Dan ud usia 11 bulan tdurnya mesti dikasih asi hingga terlelap.. Pdhal udah ngntuk Dan kenyang tpi ttp msti mimik bust isa ;insomnia
begini, awalnya saya meriang mungkin karena kehujanan kemarin sore. Lalu di malamnya saya minum kopi , alhasil saya tidak bisa tidur, tetapi nafas saya jadi pendek2 ,saya biarkan sama menenangkan diri narik napas dalam trus keluarkan, tapi tetap saja begitu setelah itu tiba2 rasanya kaya kesemutan?gemetar ? Hidung tangan sama kaki, kepala juga agak kliengan . Lalu saya keluar rumah hirup udara tiba2 agak baikan gak sesesak tadi. Namun sekarang hidung , tangan, kaki masih terasa seperti kesemutan atau gemetar. Saya juga sudah minum air banyak tapi tetap seperti itu . Cuman lebih mendingan daripada tadi ;insomnia
sy sdng mengkonsumsi tanapres, bisoprolol, Hct. Durasi tidur sy pd malam hari 3-4 jam, terbangun utk ketoilet dan setelah itu sulit tdr kembali, kondisi kamar baik dan pikiran biasa sj, apakah ada pengaruh dr obat ;insomnia
usia sy 51 thn, durasi tidur mlm sy hanya 3-4 jam dan siang tdk tidur, kamar baik, pikiran biasa sj, olah raga sore, tp mengapa nyenyak tdrnya hanya ;insomnia
saya sangat hobi minum kopi sachet seperti G**d D*y dan itu 1 hari saya bisa menghabiskan sebanyak 6 sachet , namun saya diberi tahu oleh rekan saya bahwa tidak boleh terlalu banyak minum kopi sachet dikarnakan bisa gangguan jantung dok ;insomnia
Pagi Dok Saya Mau Bertanya Tolong d jawab yhaa dok.Jadi Gini saya Sudah Mengalami Gangguan Sulit Tidur Di malam hari Selama 2 minggu Ini katanya Saya Kena Insomnia Dan Saat Saya Membaca Artikek Tentang Insomnia Katany Orang Yang Kena Insomnia Akan Memiliki Umur Yang lebih pendek Apakah It Benar doj Tolong D jawab Yhaa Terima ;insomnia
sekitar satu tahun saya mengalami insomnia akibat depresi. awalnya saya tidak bisa tidur dalam 5 hari biar pun rasanya capek dan ngantuk tetap aja pikiran tidak bisa diam. sampai akhirnya saya pergi ke UGD dan dokter memberi saya satu butir ATIVAN obat tidur. setelah saya minum langsung saya tertidur nyenyak. besok nya saya pergi lagi ke dokter untuk meminta resep obat tersebut (ATIVAN). tapi dokter tidak memberi obat itu melainkan AMBIEN saya diberi obat tersebut untuk 30 hari dengan catatan saya tidak boleh minum obat ini lebih dari sebulan. Saya minum obat itu memang saya bisa tidur tapi tidak nyenyak. tidak terasa sampai 3 bulan saya pakai AMBIEN untuk tidur. setelah itu obat ini tidak ada efek nya lagi buat tidur saya. lagi2 saya tersiksa tidak bisa tidur. Sampai satu hari ada kawan saya menyarankan pakai cannabis untuk tidur. dan memang saya bisa tidur hampir 8 bulan lamanya saya pakai cannabis buat tidur. dan sekarang cannabis pun bikin saya anxiety dan terpaksa saya cari2 lagi ATIVAN untuk tidur. Dokter memberi saya tapi 15 butir dan itu dipakai seperlunya katanya. Saya tinggal dan kerja jauh dari keluarga sudah lebih 12 tahun saya meninggal kan mereka. saya juga melatihkan diri teknik pernafasan,yoga,dan juga makanan buah2an saya lakukan, juga pakai obat2an HERB tapi tetap sedikit membantu saya untuk kembali seperti dulu. Apakah ini efek dari pemakaian AMBIEN continue selama 3bulan atau memang saya sudah tergantung dengan ATIVAN. saya baca informasi dari google obat2an jenis Benzo ini memang berbahaya untuk kesehatan otak ? samapai saat ini saya masih minum ATIVAN 1mg setiap malam untuk tidur. Mohon saran nya DOK terimakasih atas ;insomnia
dok, saya mau nanya, jadi semalem pukul 01.00 saya minum es capucino lalu saya semaleman tdk bisa tdr dok, dan skrng pun mata saya masih seger. Apakah ada efeknya ya dok? ;insomnia
usia saya 19 tahun. sudah lebih dari seminggu tidak bisa tidur normal, tidur jam 5 pagi bangun siang mungkin karena stress pekerjaan. saya coba obat tidur Valdres kurang lebih 30 menit kemudian mengalami diare, apakah ada saran? ;insomnia
