kalimat;tag
wanita usia 26 tahun, di usia yang sekarang saya tidak memiliki kelebihan apapun. saya tidak menemukan suatu hal yang membuat saya benar-benar menyukainya ketika dilakukan, saya juga kehilangan minat terhadap hal-hal yang saya sukai, sering sulit untuk tidur, memiliki keinginan untuk mengakhiri hidup saja. selain itu saya juga tidak memiliki teman untuk berbagi cerita, teman-teman saya sudah sibuk dengan dunianya sendiri. saya juga kerap kali membandingkan diri dengan anak-anak lain seusia saya yang hidupnya jauh lebih baik, sudah bekerja atau sudah punya penghasilan sendiri. Sedangkan saya hanya makan dan tidur saja, kuliah pun belum selesai. adakah obat untuk mengembalikan minat saya agar menyukai hal-hal yang saya ;depresi
saya merasa sakit bernapas, sesak, hilang semangat,lemas,mudah putus asa, ketakutan,dikejar² sama rasa bersalah, menyesal, susah tidur, mudah emosi,bahkan sempat mau bunuh diri. Saya putus cinta, sepanjang hari saya menangis mencoba berfikir jenih tapi itu membuat saya semakin depresi. Saya terus berdoa tpi tidak mendapat penyelesaian hidup saya. Saya tidak tahu bagaimana cara ny lg dok. Sudah parah kah penyakit saya dok? Semua terasa ;depresi
dok, saya berumur 17 tahun, gini dok. Saya sering merasakan sakit kepala, nafsu makan turun, dan entah kenapa saya lebih sering mengurung diri dan kadang mood saya berubah drastis, kadang saya takut dengar suara yang sangat besar, kadang nangis tanpa sebab. Setelah aku cari tahu di Google katanya, itu termasuk depresi ya dok? Tolong dok, tips ;depresi
sebetulnya cukup sulit saya untuk menjelaskan keadaan saya, saya mengalami pelecehan seksual oleh sepupu saya saat kecil, seingat saya itu terjadi ketika saya sd kelas 1-2,pelecehan yang saya alami masih di batas meraba kelamin, kalau saya di tanya apa kah saya mengalami trauma karna itu, sulit untuk sya menjawab apakah iya atau tidak, untuk orang tua sendiri mereka tida ada yang mengetahui nya, dan saya tiba berharap untuk mereka tau, terkadang saya merasa panik berlebihan, kekosongan,dan jijik berlebih, pada saat umur itu juga saya mengalami pembulian di sekolah, pembulian it terjadi pada tk sampai sd kls 4, mulai saat itu saya menyadari saya tidak pernah menunjukan diri saya yang sebenarnya kepada orang orang, saya memiliki banyak teman di smp, tp saya masih merasa mereka tidak tau ap ap tentang saya, saya leleh melakukan semua ini, saya ingin berhenti, saya beberapa kali berfikir untuk menyakiti diri sya, tp ketika it pula logika saya menolak, saya tidak ingin menyakiti diri, tp akhir akhir ini sulit untuk menahan rasa ingin menyakiti diri, tp saya msih ingin tetap mencoba agar tida melukai diri, di keluarga saya jg sya di tuntun melakukan sesuatu yang saya rasa saya tida mampu, tp saya tidak bisa menolak nya, saya sering memiliki mood yang naik turun secara parah, dan dr mulai sekolah online jam waktu tidur saya bener bener tida teratur, saya sering mengalami cemas berlebih, mimpi buruk, perasaan tidak nyaman, saya ingin meminta saran dok, bagai mana agar saya merasa sedikit lebih ;depresi
selama ini hidup dalam tekanan dan semua harus serba nurut orang tua, orang tua saya jarang memberi peluang saya dalam berargumen.. hal yang saya rasakan saat ini adalah turunnya gairah hidup, dan lebih parahnya lagi hilang konsentrasi belajar dan malas luar biasa. padahal dulu saya adalah murid yang berprestasi, belajar adalah hobi saya namun sekarang jadi berubah hari ini saya sering merasa kantuk luar biasa, sering menguap dan dada berdegup kencang dan agak sesak, dokter selalu bilang saya stress, tp setiap saya dirumah saya tidak dapat kelola stress ;depresi
dokter,, dalam beberapa tahun terakhir ini, sy sering sakit kepala dibagian belakang dan sakit kepala sebelah, 1mg sy bisa minum obt 4-5x/butir,, biasanya sy minum obat Bodrex extra atw Bodrex migran,, sy udh ketergantungan obat selama beberapa tahun ini dr THN 2018-sekarang 2021telebih jika sy banyak pikiran atw pun banyak masalah,, saya sering sekali merasa sedih yg berlebihan,, dan rasa sedih itu, membuat sy punya niat bunuh diri atw hal hal yg diluar pemikiran sy saya,, sy jg mengalami ngaguan mentruasi jika normal sy bsa mengalami nya sekitar 4hr-7hr,, tp udh 2thn ini dr 3hr bahkan hny 1hr,, berat badan saya naik begitu cepat dr 53kg manjadi 73kg dalam waktu 2thn.. Sy udh sering konsultasi kan kedokter umum diklik,, biasanya dokter bilang itu gejala stres dan biasanya sy diberikan obat parasetamol,, tp sy TDK pernah minum obat tersebut Krn rasa sakitnya TDK berkurang sama sekali,,Selama ini sy punya beban hidup tersendiri yg TDK bisa saya bagikan kekeluarga atwpun teman,, apa krna masalah ini sehingga sikologi sy terganggu? Apa yg harus saya lakukan ;depresi
dokter, saya perempuan berusia 23 tahun. Dok, saya selalu merasa bahwa saya tidak bisa apa-apa. Tidak bisa menjadi lebih baik lagi. Saya sering murung jika menyangkut soal finansial. Merasa tidak cukup, dan bingung jika keuangan tidak stabil. Saya lumayan sering tiba-tiba murung, dan merasa tidak bisa berbuat apa-apa. Saya juga merasa saya adalah beban orang lain. Saya takut untuk memulai pembicaraan dengan orang baru, saya takut dijudge menjadi orang yang tidak bisa diandalkan. Perasaan yang saya punya setiap hari adalah apa yang harus saya lakukan aga saya sukses dan bahagia. Perasaan itu lumayan membuat saya bingung.Saya tidak berani memulai berhubungan dengan orang, bahkan lawan jenis dok. Saya tidak pernah berharap untuk mempunyai pasangan karena saya merasa saya tidak pantas dan takut orang lain tidak bisa menerima saya dan keluarga saya.Kira-kira apa yang harus saya lakukan dok, agar saya lebih enjoy dalam menjalani kegiatan ;depresi
saya mau bertanya ..kenapa ya dok mulai dari dulu saya sering marah,nangis,tanpa sebab terus bahkan dulu saya waktu smp sering melukai diri saya sendiri..dan bahkan emosi saya tidak stabil dan saya gak bisa ngejaga mood saya sendiri ..bahkan saya tidak bisa menceritakan kondisi saya yang sebenarnya ke orang lain bahkan saya selalu melakukan kebohongan terhadap orang tua saya ...dan saya tidak bisa berkata dan curhat terhadap ibu saya sendiri.saya selalu cerita ke teman teman dekat saya tentang kondisi saya yang sbnrnya ..apa ada solusi dari permasalahan saya dok ;depresi
pagi dok, saya ingin bertanaya mengenai perawatan atau penanganan yang dilakukan pada penderita kecemasan atau depresi. Apakah memang mereka membutuhkan rawat inap, dengan kondisi seperti apa? dan berapa jika memang membutuhkan, berapa lama perawatannya? Terima ;depresi
dok, mohon atas pencerahannya,jd saya mengalami kondisi dimana setiap saya menuju ke suatu tempat, saya merasa harus kembali ke rute yg sama pada saat saya menuju tempat tersebut, jika saya tidak kembali ke rute yg sama, saya merasa cemas, mual, dan kepikiran oleh kejadian tersebut.Saya merasa ada tali dibelakang saya yang menjulur panjang, dan saya merasa tali itu tidak boleh mengelilingi sesuatuAda kalanya saat saya melewati seseorang dijalan, saya merasa harus kembali melewatinya lg ke arah berlawanan, saya merasa agar talinya tidak terbawa/tertarik/terdorong oleh orang yang saya lewati tadiSaya merasa risih dengan keadaan sayaNama kasus yg saya alami apa ya dok?Dan cara penyembuhannya gimana ya?Kondisi seperti ini normal ga sih dok?Mohon atas ;depresi
dok . Saya mau tanya . Dulu sekitar 3 thn lalu saya operasi , dan 2 hari setelah operasi kata keluarga saya, saya mengalami step , tapi yg saya rasa kan saya merasa ada yang memanggil manggil saya , tapi hanya saya saja yg mendengar itu . Dan suara nya seperti mengajak saya untuk pergi .karna suaranya seram menghanyutkan . Sampai saat ini kalau mendengar suara itu saya merasa ketakutan.Akhir akhir ini saya tidur susah karna ada suara yg seram memanggil nama saya terus . Apa kah saya mengalami gangguan mental atau halusinasi ya dok ;depresi
siang Ibu/Bapak Dokter, saya wanita berusia 24 thn dari hari senin saya mengalami perubahan perasaan yang dratis, dari yang sedih banget sampai nangis bisa senang dan tdk jarang tidak merasakan apapun seperti nyaman gitu tenang gitu tapi ngga terlalu bahagia. Kondisi ini sudah saya alami dari remaja. Sempat pernah berada diposisi terburuk sampai berpikir mau bunuh diri dan beranjak dewasa menjadi wanita yang anti sosial tapi masih bisa menanganinya dan parah 1 tahun terakhir ini. Sebenarnya apa yang saya idap Ibu/Bapak Dokter? mohon ;depresi
tahun yang lalu saya mengalami toxic relationship, dan itu membuat saya takut dan ingin menangis terus menerus, kadang kadang saya juga suka tiba2 menangis tanpa sebab, saya mencoba untuk seperti biasa lagi, tapi masih selalu datang ingatan2 buruk itu, seperti di kasari verbal, semenjak itu saya jadi takut apa2 dan selalu menutup diri dan tidak merasa ;depresi
sekarang saya kelas 3 SMA. udah sebulan ini saya sering merasa diserang oleh beberapa emosis secara tiba tiba. panik,gelisah,perasaan tidak aman,sedih,kaget,bahkan sampai sesak nafas. dan semua itu menyerang saya secara bersamaan. misalnya saya tidak sedang mengerjakan sesuatu, bahkan sedang santai pun bisa tiba tiba terserang emosi itu semua yg saya sebutkan tadi. saya pikir ini semua bertahap. saya pernah merasa tiba tiba sedih sejak SMP. tapi saya anggap biasa, saya pikir semua orang juga mungkin begitu. dan itu pun jarang sekali. tapi lama kelamaan, mulai bertambah sering perasaan tiba tiba sedih itu. tanpa sebab. sampai saya merasa mulai sering itu kelas 1 SMA. saya sempat sakit ringan tidak sembuh sembuh, bolak balik ke dokter sampai tipes, bahkan di usia muda saat itu saya 15 tahun sudah pernah rekam jantung. karena suka degdegan kencang tiba tiba. saya rasa puncak nya sekarang, saya sering merasa diserang berbagai macam emosi secara tiba tiba dan tanpa sebab. jadi pada saat misalnya saya panik dengan alasan yg pasti, reaksi saya sangat berbeda dengan sebelumnya. kini ketika saya panik dengan alasan jelas nafas terasa sesak dan lemas,gemetar pula. saya juga sekarang sulit menangis. dulu gampang nangis dok, nonton film ada adegan sedih sedikit aja pasti nangis. saya juga sekarang mudah tersinggung. saya gak depresi kan dok? karena berat badan saya normal aja ;depresi
dok, Saya seorang remaja yang telah mengalami pelecehan seksual yang tak lain dilakukan oleh ayah saya. Setelah kejadian itu, Saya menjadi takut dengan laki-laki, Saya lebih pendiam dan memendam emosi, beberapa kali Saya juga pernah melakukan hal yang menyakiti diri saya, emosional Saya tidak terlampiaskan keseluruhan, dan Saya akhirnya memilih untuk menjauh dari rumah dan merantau di suatu kota lain. Namun pikiran Saya masih terlintas, seperti trauma akan hal-hal seksual. Saya menjadi lebih sensitif (ketakutan) ketika bertemu/melihat hal-hal seksual dan juga laki-laki, bahkan sampai menangis dan berpikir bagaimana Saya kelak memiliki keluarga jika Saya masih ketakutan dengan laki-laki dan tindakannya? terimakasih ;depresi
dok, Saya Sinta umur 24 thn, sudah beberapa minggu ini saya sering merasa sedih, sendirian, sering menangis sebelum tidur, merasa iba kepada diri sendiri, sering berpikiran negatif terhadap org sekitar saya, tidak bisa tidur waktu tidur saya rata” dibawah jam 3 pagi, sering merasa marah kepada diri sendiri ketika saya merasa sedih dan emosi saya akan merasa sangat lega dengan memotong rambut setiap kali perasaan itu muncul beberapa kali mencoba menyakiti diri sendiri tapi setelah itu saya merasa lebih tenang seperti tidak terjadi apa” dan tidak ada perasaan menyesal samasekali ditambh karena lelah bekerja membuat saya semakin stress, apakah ini sudah termasuk gejala depresi? bagaimana solusi untuk membuat perasaan saya lebih tenang ketika perasaan itu ;depresi
dok, Saya sering sekali membayangkan diri saya dalam bahaya tanpa sadar, misalkan saya akan menuruni tangga karena kebiasaan saya yang suka merencanakan sesuatu sebelum melakukan nya bahkan untuk menuruni tangga sekalipun, nah selalu terbesit hal yang sangat bahaya seperti saya tiba tiba jatuh tersandung dan berdarah, saya lompat dari anak tangga paling atas untuk kebawah hingga kaki saya potong atau apapun yang membuat saya dlm keadaan bahaya dan itu pasti sadis. Saya sedikit memiliki sifat perfectsionis yang harus selalu merencanakan segala hal dan terus menerus melakukan hal yang saya sudah lakukan misal seperti mengunci pintu, menutup gorden, mencabut chargeran, mematikan air dikamar mandi.. Apakah itu sebuah penyakit jiwa? Saya selalu takut karena itu membuat kepala saya sakit dan pusing karena pikiran yang berbahaya terus dan capek harus melakukan hal berulang kali tanpa sadar... Terimakasih atas waktu untuk menjawab nya ;depresi
dok, saya heniAkhir-akhir ini saya sering bingung dan sulit konsentrasi. Kalo saat bekerja, saya sering menghindari teman-teman yang lain. Jarang ingin bersosial. Terkadang melihat keadaan sekitar jadi acuh tak acuh. Apa benar itu salah satu gejala depresi?Terima ;depresi
dok,Sejak kecil saya selalu hidup seperti yang diinginkan orang tua saya, baik itu sekolah, kesenangan, pergaulan, jurusan perkuliahan, saya yang sebenarnya tidak suka berbicara diharuskan berbicara banyak. Mereka hanya menuntut hasil tanpa mengetahui prosesnya. Dan sekarang saya merasa sangat lelah akan tuntutan mereka. Ketika mereka ingin melakukan sesuatu terhadap orang lain, namun saya menolak, mereka tetap melakukan. Pada saat mereka menyesal, mereka mengadu pada saya dan meminta saya untuk ini dan itu supaya mereka tidak dianggap remeh oleh orang2 tersebut. Padahal saya selalu melakukan yang terbaik bahkan tanpa diminta, namun ketika mereka mengucapkan kalimat yang sama setiap hari lebih dari 3x sehari, saya merasa tertekan. Seakan saya pernah mengecewakan mereka.Sekarang saya merasakan gejala depresi (menurut sumber). Saya mengabaikan semua yang harus saya lakukan ditahap akhir kuliah. Saya sudah berulang kali berkeinginan untuk mengakhiri hidup. Yang pertama saat masa sekolah, mungkin saat itu saya masih SMP. Tapi saat itu saya minum deterjen, jadi itu tidak berguna. Kali kedua saat SMA, saya minum berbagai macam obat rumah sakit dosis tinggi dalam satu waktu. Namun itu juga tidak berguna. Setahun belakangan ini saya suka memukul kepala ke tembok atau menarik rambut saya ketika saya sudah merasa sangat pusing mendengar kalimat berulang proposalmu supaya cepat Padahal awalnya saya sangat rajin mengerjakannya, tapi sekarang saya mengabaikannya. Bukankah revisi itu wajar? Apalagi saat dosen pembimbing adalah seorang perfeksionis. Bukankah begitu? Tapi orang tua saya tidak mau mengerti. Apakah sains bisa disamakan dengan sosial? Berulang kali saya memberi pengertian dan akhirnya saya hanya bisa diam dan menerima seperti biasanya.Sekarang saya seakan hilang rasa terhadap orang tua saya. Ketika mereka berkata panjang lebar, sekarang saya merasa kosong dan tidak lagi ingin menangis. Jika dulu jari saya tersayat pisau saya akan merasa perih, sekarang saya hanya merasa gatal dan geli. Terkadang dalam keadaan normal atau saat saya sedang membaca novel, saya akan menangis. Saya tidak tau apa yang saya tangisi, hanya saya merasa sesak. Namun kemudian saya akan melamun (ini sudah terjadi kurang lebih 4tahun belakangan).Bagaimana menurut dokter keadaan saya? Apakah saya perlu ke ;depresi
dokter, selamat malam. Saya seorang pelajar berusia 19 tahun. Akhir akhir ini saya merasa aneh dok. Jantung saya berdetak lebih cepat daripada biasanya, terkadang resah, sulit konsentrasi, dan yang saya rasa paling aneh adalah tidur lebih lama. Jadi, akhir akhir ini saya tidur 9-10 jam di malam hari dan tidak bisa tidur kurang dari 8 jam, karena jika saya tidur kurang dari 8 jam maka di pagi hari saya akan terus mengantuk dan terus terusan ingin tidur. Kira kira apa penyebab nya ya ;depresi
jujur saya ngerasa caper bahkan sampe saya melakukan self harm. Biasanya orang yang melakukan selfharm menutupi lukanya tapi saya malah berharap ada orang yang melihatnya. Walaupun saya tidak terlalu menunjukan, saat ada orang yang melihat luka saya dan berbuat baik pada saya, saya merasa senang, dan malah makin cari perhatian. saya merasa benci sama diri saya sendiri karena hal itu dan setiap mengingat momen-momennya membuat saya menangis dan bertanya tanya mengapa saya begini. Saya merasa orang-orang pun tau kalau saya caper dan benci juga sama saya. Saya mohon minta solusinya dok saya harus ;depresi
saya banyak mengalami trauma masa kecil, mulai dari keluarga yang tidak utuh, pengabaian, sering dupukuli, dilecehkan orang lain sampai saya merasa diri saya kotor dan tidak pantas hidup dok, saya berkali-kali mau mati tapi takut,tapi rasanya seperti saya ingin memotong kepala saya agar tidak memikirkan hal-hal itu dok,saya seperti orang gila tertekan dan menangis tiba-tiba, tidak bisa kontrrol emosi. apakah saya harus ke psikiater dok?? jika iya apa bisa melalui layanan alodokter? daerah saya aksesnya susah untuk pskiater. terimakasih, sYa bertanya krna sudah putus ;depresi
malam dok,saya ingin bertanya. Kebetulan saya baru saja bertemu dengan teman saya dan dia sedikit aneh. Menurut orang tuanya dia sedikit ngawur dan linglung,diajak ngobrol kadang nyambung dan kadang juga ngawur,tapi dia ingat sama semua orang tapi apa mungkin pengaruh dia pulang dari luar negeri dia sudah seperti itu,seperti planga plongo dan ngawur dan sering bilang bahwa dirinya gila. Gimana cara mengobatinya,sedangkan dia disuruh dibawa ke dokter ngga mau dan mengangggap dirinya gila. Mohon dijawab ;depresi
dok saya mau bertanya, yang pertama, kenapa ya terkadang saya kalau berbicara apa yang mau saya katakan malah yang saya ucapkan apa yang ada dipikiran saya, padahl saya tidak ingin mengucapkan itu,contohnya saya mau bilang apa kabar, tapi di pikiran saya sedang berfikir kamua dari mana nah yang saya ucapkan malah yang kamu dari mana, kenapa ya dok?Yang ke dua , syaa mau bertanya, kenapa saya sering mendengar - mendengar hal2 yang tak jelas padahl itu tak ada, seperti kadng mendengar suara ngaji pdahal tidak ada, suar aadzan padahl tdk ada, dan suara2 tak jelas entah itu apa pdhl sebenarnya tak ad suara, saya pikir itu halusinasi tetapi itu sering terjadi, kenapa ya dok?Mohon penjelasannya, ;depresi
dok, saya mahasiswi berusia 22 tahun. Bbrp tahun yg lalu tepatnya tahun 2018 saya berada di titik terendah saya, saya kehilangan mimpi saya yg saya kan dari kecil, padahal tinggal sedikit lagi bisa saya raih. Karna hal itu saya mendapat banyak omongan yg membuat saya cukup down, bahkan setelah kejdian tersebut berlalu saya msh dpt omongan. Walau saya tau yg mrk bicarakan tdk benar tp saya tdk bs menentang. Kejadian itu membuat saya selalu sampai skrg, terutama ketika akan tidur, shg membuat saya sulit tdr. Ketika mndgr kalimat yg berhubungan dgn kejadian trsbt saya menjadi tdk nyaman dan takut, saat saya mengunjungi tmpt kejadian tersebut pun demikian. Terkadang saya menangis, dan beberapa kali dada saya sesak, tangan dingin, gemetar dan merasa aneh, merasa tidak nyata saat mengingat kejadian itu. Apakah yg saya alami ini termasuk gejala PTSD atau hanya gangguan kecemasan atau gangguan mental lainnya..?Demikian pertanyaan saya, semoga dokter jawab. ;depresi
malam dok, saya perempuan berumur 24 tahun. Belakangan ini saya susah tidur, saat berusaha untuk tertidur, nafas saya justru sesak padahal saya tidak ada riwayat asma. Saya sudah mencoba untuk membuat diri saya lelah, melakukan banyak aktivitas pada siang hari sampai sore agar bisa terlelap pada malam harinya, tapi itu tidak berpengaruh dan saya tetap susah tidur.Sebelumnya saya juga sudah pernah konsultasi dengan psikiater pada November 2019 sampai Oktober 2020, saya didiagnosa depresi, saya menghentikan kontrol secara sepihak karena merasa sudah lebih baik dan takut ketergantungan antidepresan. Awalnya baik saja hingga mulai Desember kemarin lagi-lagi depresi saya kambuh dan jadi susah tidur lagi. Apa dokter bisa merekomendasikan sesuatu selain obat antidepresan atau obat tidur agar saya bisa tidur dengan lelap dan tepat waktu? Apa yang harus saya ;depresi
dok. Saya Derra, usia 19 tahun.Saya ingin bertanya. Dalam beberapa bulan ini, saya sering merasa cemas saat sedang berada di lingkungan luar rumah. Saya merasa takut terhadap orang lain bahkan terhadap seseorang yang saya kenal sekali pun. Saya merasa bahwa pandangan mereka terhadap saya itu tidak baik. Saya sering merasa tidak nyaman dengan pandangan setiap orang seolah mereka menilai saya buruk. Saya pun merasa rendah jika tengah berada di keramaian. Maka dari itu, saya sering berada di rumah dan hal itu lebih membuat saya nyaman.Saya juga selalu menarik diri dari orang-orang. Saya tidak senang untuk bersosialisasi karena hal tersebut juga membuat saya merasa takut dan cemas. Saya setiap diajak bicara, juga akan terlihat gugup dan canggung. Terkadang tangan saya akan cukup bergetar dan kecemasan saya rasakan saat akan menghadapi orang lain (seperti hendak bertanya atau akan mengatakan sesuatu).Kecemasan itu selalu saya lampiaskan. Terkadang, saya bisa melukai diri dan pernah beberapa kali berniat untuk mengakhiri hidup karena tekanan yang tidak bisa saya kendalikan. Saya juga memiliki masalah sulit untuk tidur. Saya merasa cemas saat memikirkan 'bagaimana saya harus menghadapi hari esok?'.Saya ingin berobat dan melakukan konsultasi dengan dokter. Tapi, sampai saat ini, saya masih belum berani terbuka mengenai masalah saya. Saya tidak bisa mempercayai orang lain. Saya hanya takut dihakimi dan dipandang buruk.Apa yang seharusnya saya lakukan untuk mengatasi masalah saya?Mohon pencerahannya, ;depresi
dok! Saya ingin bertanya, saya usia 25 dan tahun lalu saya di vonis memiliki depresi berat. Lalu saya sering merasakan sesak,gemetar dan sering menangis pada saat bersamaanDan itu berlangsung hampir sering, hingga saya juga melakukan self harm ketika saya merasakan sesak.Apakah itu efek lain dari depresi yang saya derita?Atau ada gejala lain ya? Mohon pencerahannya dok. ;depresi
dok, izin bertanya. Saya dari bulan maret merasakan terkadang mudah marah dan terkadang ketika menahan amarah jika sudah puncaknya saya mengeluarkan amarah meledak-ledak, emosional juga, lalu selain itu mudah lelah, kurang nafsu makan, tidak ingin melakukan aktivitas apapun/tidur berlebihan, overthinking, sering memikirkan hal yang sedih dan paling parahnya pernah sangat putus asa. Kira-kira gejala apa ya dok? Apakah saya mengalami depresi dok? ;depresi
dok, saya laki laki umur 17th.Saya di rumah kadang pas lagi bosen main hp, biasanya saya menyendiri di kamar atau di dapur, dan tempat lain yang sepi, dan bermain main menggunakan tangan atau anggota tubuh lain sambil berimajinasi (kadang berimajinasi tentang pertarungan) seperti membayangkan sesuatu terjadi, dan saat ada orang lain yang mendekat ke saya ,saya langsung bersikap normal seperti melakukan kegiatan biasa.Saya hanya melakukan ini saat dirumah waktu bosan dan di tempat sepi, saya tidak pernah melakukan ini di tempat lain seperti sekolah, rumah saudara, dll. Saya sudah melakukan kebiasaan ini sejak kecil.Jadi, apakah saya mempunyai sejenis gangguan kepribadian/mental tertentu, ;depresi
saya masih merasa tidak puas saat menyakiti diri sendiri? apakah artinya saya berharap ada orang lain yg melakukannya untuk saya agar saya merasa ;depresi
saya perempuan berusia 25 tahun. Selama ini saya mengira saya adalah orang yang introvert dan tidak suka keramaian. Tapi beberapa waktu ini saya merasakan keinginan kuat untuk sendirian. Ada banyak waktu dimana saya membenci suara orang-orang. Kalimat yang diucapkan dengan nada tinggi, komentar, atau penolakan yang bahkan tidak diucapkan kepada saya membuat saya ketakutan. Hal seperti itu membuat saya ingin pergi dan menjauh dari orang-orang. Saya tidak percaya orang lain, terbiasa melakukan segala hal sendirian, dan seringkali marah jika pekerjaan saya diambil alih orang lain. Saya sering menangis sendirian tapi tidak tahu harus berbuat apa. Dengan gejala seperti ini, apakah mental saya terganggu atau hanya sekedar kecemasan biasa? Apakah kondisi saya serius dan membutuhkan penanganan ;depresi
malam dok, saya mengalami depresi berat dan gangguan kecemasan. Dokter meresepkan saya obat racikan, amitryptiline dan lorazepam. Saya bekerja sebagai programmer dari pagi hingga sore, dan selalu mengalami ngantuk yang tidak tertahankan dan kesulitas untuk fokus. Saya sudah konsultasikan ke dokter saya namun memang efek samping dari obat yang saya konsumsi adalah itu. Bagaimana cara mengurangi kantuknya dok? Selain meminum kopi karena saya tidak disarankan dokter saya untuk meminum kopi juga. Terima ;depresi
siang, saya izin bertanya dan apabila diberi saran saya sangat berterima kasih. Saya mahasiswa lanjut di mana saat keadaan normal saya lebih suka menghabiskan waktu di luar rumah namun di tempat yang cenderung sepi, diskusi pun saya lebih suka dalam skala kecil karena hal tsb membuat saya lebih paham. Semenjak keadaan tidak seperti dulu, saya jarang keluar rumah karena paham mikroba bisa membahayakan tergantung sifatnya. Hal ini membuat saya sulit berkonsentrasi di rumah. Saya cukup sensitif terhadap suara dan dapat mengenali asal dari suara tsb, hal ini membuat saya terkadang tergganggu dan membuat saya sulit konsentrasi berikut aturan2 yg ada di rumah. Untuk alternatif dari saya sendiri, saya memutuskan untuk tinggal jauh dari rumah dengan alasan yg logis, which sadly, rejected by them. Rasa cemas tsb masih ada, sudah coba konsumsi makanan yg mengandung antidepresan, but that feels are coming ;depresi
